LEFTBASILAROCCLUSION,Thrombotic or embolic blockage of the left Basilar artery
LEFTCAROTIDSTROKE,Acute infarct in the left Internal carotid artery territory
LEFTCAROTIDSYNDROME,Typical deficits of left Internal carotid artery involvement
LEFTCAROTIDOCCLUSION,Thrombotic or embolic blockage of the left Internal carotid artery
LEFTVERTEBRALSTROKE,Acute infarct in the left Vertebral artery territory
LEFTVERTEBRALSYNDROME,Typical deficits of left Vertebral artery involvement
LEFTVERTEBRALOCCLUSION,Thrombotic or embolic blockage of the left Vertebral artery
RIGHTMCASTROKE,Acute infarct in the right Middle cerebral artery territory
RIGHTMCASYNDROME,Typical deficits of right Middle cerebral artery involvement
RIGHTMCAOCCLUSION,Thrombotic or embolic blockage of the right Middle cerebral artery
RIGHTACASTROKE,Acute infarct in the right Anterior cerebral artery territory
RIGHTACASYNDROME,Typical deficits of right Anterior cerebral artery involvement
RIGHTACAOCCLUSION,Thrombotic or embolic blockage of the right Anterior cerebral artery
RIGHTPCASTROKE,Acute infarct in the right Posterior cerebral artery territory
RIGHTPCASYNDROME,Typical deficits of right Posterior cerebral artery involvement
RIGHTPCAOCCLUSION,Thrombotic or embolic blockage of the right Posterior cerebral artery
RIGHTBASILARSTROKE,Acute infarct in the right Basilar artery territory
RIGHTBASILARSYNDROME,Typical deficits of right Basilar artery involvement
RIGHTBASILAROCCLUSION,Thrombotic or embolic blockage of the right Basilar artery
RIGHTCAROTIDSTROKE,Acute infarct in the right Internal carotid artery territory
RIGHTCAROTIDSYNDROME,Typical deficits of right Internal carotid artery involvement
RIGHTCAROTIDOCCLUSION,Thrombotic or embolic blockage of the right Internal carotid artery
RIGHTVERTEBRALSTROKE,Acute infarct in the right Vertebral artery territory
RIGHTVERTEBRALSYNDROME,Typical deficits of right Vertebral artery involvement
RIGHTVERTEBRALOCCLUSION,Thrombotic or embolic blockage of the right Vertebral artery
THORACICOUTLETSYNDROME,Compression of brachial plexus or subclavian vessels
LONGTHORACICNEUROPATHY,Scapular winging from serratus anterior denervation
SUPRASCAPULARNEUROPATHY,Shoulder pain with infraspinatus weakness
AXILLARYNEUROPATHY,Deltoid weakness after shoulder dislocation
FEMORALNEUROPATHY,Quadriceps weakness with reduced knee jerk
OBTURATORNEUROPATHY,Adductor weakness and medial thigh numbness
SCIATICNEUROPATHY,Weakness below knee with sensory loss posterior leg
TIBIALNEUROPATHY,Plantar flexion weakness; tarsal tunnel entrapment
SURALNEUROPATHY,Lateral foot numbness after ankle injury
LATERALANTEBRACHIALCUTANEOUSNEUROPATHY,Forearm numbness after biceps tendon procedures
BRACHIALNEURITIS,Severe shoulder pain followed by patchy arm weakness
LUMBOSACRALPLEXOPATHY,"Pelvic tumor, diabetes, or radiation causing leg weakness"
DIABETICAMYOTROPHY,Painful proximal leg weakness from diabetic lumbosacral radiculoplexus neuropathy
NERVECONDUCTIONSTUDY,Assesses large myelinated fibers via conduction velocity and amplitudes
ELECTROMYOGRAPHY,Needle exam of muscle to assess denervation and MUAPs
SINGLEFIBEREMG,Highly sensitive test for neuromuscular junction disorders
EVOKEDPOTENTIALS,Electrical responses to sensory stimulation for pathway integrity
AUTONOMICTESTING,"QSART, tilt table, Valsalva for dysautonomia"
C9ORF72,Repeat expansion causing ALS/FTD spectrum
SOD1,Superoxide dismutase gene mutated in familial ALS
HTT,Huntingtin gene with CAG expansion
PMP22,Gene duplicated in CMT1A
GAA,Trinucleotide repeat causing Friedreich ataxia
NOTCH3,Gene mutated in CADASIL small vessel disease
GFAP,Astrocytic intermediate filament; Alexander disease
ARSA,Deficiency in metachromatic leukodystrophy
GALC,Deficiency in Krabbe disease
ABCD1,Adrenoleukodystrophy peroxisomal transporter
POLG,Mitochondrial polymerase mutations causing epilepsy and ataxia
TTR,Transthyretin gene in amyloid neuropathy
CERVICALSPONDYLOTICMYELOPATHY,Gait imbalance and hand clumsiness from cord compression
RADICULOPATHY,Dermatomal pain and weakness from nerve root compression
MYELOPATHY,Spinal cord dysfunction causing long tract signs
SYRINGOMYELIA,Cavitation of spinal cord with cape-like pain/temperature loss
TETHEREDCORD,Low conus with filum thickening; progressive leg symptoms
EPIDURALABSCESS,"Fever, back pain, neurologic deficits; urgent decompression"
SPINALEPIDURALHEMATOMA,Acute cord compression after procedure or anticoagulation
SPINALAVFISTULA,Foix-Alajouanine myelopathy with venous congestion
UHTHOFFPHENOMENON,Worsening of MS symptoms with heat or exercise
HERTWIGMAGENDIE,Downbeat nystagmus with foramen magnum lesions (historical eponym)
SKEWDEVIATION,Vertical ocular misalignment from otolith pathway lesion
OCULARTILTREACTION,Head tilt with ocular torsion from vestibular imbalance
GOWERSIGN,Proximal weakness sign when rising from floor
BABINSKISIGN,Extensor plantar response indicating UMN lesion
CHADDOCKSIGN,Alternative plantar reflex elicitation method
LEFTHEMIANOPIA,Visual field loss on the left half of both eyes
LEFTHEMIPARESIS,Weakness of the left side of the body
LEFTNEGLECT,Inattention to the left side of space
LEFTFACIALPALSY,Lower motor neuron facial weakness on the left
LEFTPRONATORDRIFT,Arm pronates and drifts on the left indicating UMN lesion
LEFTATAXIA,Limb incoordination more on the left
RIGHTHEMIANOPIA,Visual field loss on the right half of both eyes
RIGHTHEMIPARESIS,Weakness of the right side of the body
RIGHTNEGLECT,Inattention to the right side of space
RIGHTFACIALPALSY,Lower motor neuron facial weakness on the right
RIGHTPRONATORDRIFT,Arm pronates and drifts on the right indicating UMN lesion
RIGHTATAXIA,Limb incoordination more on the right
CRANIALNERVE3PALSY,"Deficit with ptosis, 'down and out' eye, and mydriasis"
CRANIALNERVE4PALSY,Deficit with vertical diplopia worse on down gaze
CRANIALNERVE6PALSY,Deficit with horizontal diplopia from impaired abduction
CRANIALNERVE7PALSY,Deficit with facial weakness and loss of taste anterior two-thirds
CRANIALNERVE9PALSY,Deficit with loss of gag and posterior third taste disturbance
CRANIALNERVE10PALSY,Deficit with dysphonia and impaired palate elevation
CRANIALNERVE12PALSY,Deficit with tongue deviation toward lesion on protrusion
DOWNBEATNYSTAGMUS,Fast phase downward; cervicomedullary junction localization
UPBEATNYSTAGMUS,Fast phase upward; medullary localization
GAZEEVOKEDNYSTAGMUS,Increasing on eccentric gaze; cerebellar
OPSOCLONUS,Chaotic multidirectional saccades without intersaccadic intervals
BACLOFEN,GABA-B agonist used for spasticity
TIZANIDINE,Alpha-2 agonist for spasticity
DANTROLENE,Ryanodine receptor blocker reducing muscle contraction
TRIHEXYPHENIDYL,Anticholinergic for tremor in young PD patients
BENZTROPINE,Anticholinergic for parkinsonian tremor
PIMAVANSERIN,5-HT2A inverse agonist for PD psychosis
RIVASTIGMINE,Cholinesterase inhibitor used in dementia
DONEPEZIL,Cholinesterase inhibitor for Alzheimer disease
GALANTAMINE,Cholinesterase inhibitor for Alzheimer disease
MEMANTINE,NMDA antagonist for moderate to severe Alzheimer disease
