Left putaminal stroke,Infarct predominantly affecting the putaminal region on the left
Left caudate stroke,Infarct predominantly affecting the caudate region on the left
Left pontine stroke,Infarct predominantly affecting the pontine region on the left
Left medullary stroke,Infarct predominantly affecting the medullary region on the left
Left occipital stroke,Infarct predominantly affecting the occipital region on the left
Left parietal stroke,Infarct predominantly affecting the parietal region on the left
Left temporal stroke,Infarct predominantly affecting the temporal region on the left
Left frontal stroke,Infarct predominantly affecting the frontal region on the left
Left cerebellar stroke,Infarct predominantly affecting the cerebellar region on the left
Right thalamic stroke,Infarct predominantly affecting the thalamic region on the right
Right capsular stroke,Infarct predominantly affecting the capsular region on the right
Right putaminal stroke,Infarct predominantly affecting the putaminal region on the right
Right caudate stroke,Infarct predominantly affecting the caudate region on the right
Right pontine stroke,Infarct predominantly affecting the pontine region on the right
Right medullary stroke,Infarct predominantly affecting the medullary region on the right
Right occipital stroke,Infarct predominantly affecting the occipital region on the right
Right parietal stroke,Infarct predominantly affecting the parietal region on the right
Right temporal stroke,Infarct predominantly affecting the temporal region on the right
Right frontal stroke,Infarct predominantly affecting the frontal region on the right
Right cerebellar stroke,Infarct predominantly affecting the cerebellar region on the right
Dawson fingers,Ovoid periventricular lesions perpendicular to ventricles in MS
U fiber sparing,Subcortical myelin preservation favoring leukodystrophy over hypoxic change
Black holes in MS,T1 hypointense chronic lesions indicating axonal loss
Open ring sign,Incomplete ring enhancement suggesting demyelination
Brodmann area 44,Part of Broca region for speech production
Brodmann area 45,Inferior frontal gyrus language area
Brodmann area 22,Wernicke region for language comprehension
Brodmann area 6,Premotor and supplementary motor area
Brodmann area 3,Primary somatosensory cortex subregion
Brodmann area 5,Somatosensory association cortex
Left frontal lobe infarct,Ischemic injury in the frontal lobe on the left
Left parietal lobe infarct,Ischemic injury in the parietal lobe on the left
Left temporal lobe infarct,Ischemic injury in the temporal lobe on the left
Left occipital lobe infarct,Ischemic injury in the occipital lobe on the left
Left insular lobe infarct,Ischemic injury in the insular lobe on the left
Left MCA branch occlusion,Branch vessel blockage in the MCA territory on the left
Left ACA branch occlusion,Branch vessel blockage in the ACA territory on the left
Left PCA branch occlusion,Branch vessel blockage in the PCA territory on the left
Right frontal lobe infarct,Ischemic injury in the frontal lobe on the right
Right parietal lobe infarct,Ischemic injury in the parietal lobe on the right
Right temporal lobe infarct,Ischemic injury in the temporal lobe on the right
Right occipital lobe infarct,Ischemic injury in the occipital lobe on the right
Right insular lobe infarct,Ischemic injury in the insular lobe on the right
Right MCA branch occlusion,Branch vessel blockage in the MCA territory on the right
Right ACA branch occlusion,Branch vessel blockage in the ACA territory on the right
Right PCA branch occlusion,Branch vessel blockage in the PCA territory on the right
Sensory level at C2,Pinprick reduced below dermatomal level C2
Sensory level at C3,Pinprick reduced below dermatomal level C3
Sensory level at C4,Pinprick reduced below dermatomal level C4
Sensory level at L1,Pinprick reduced below dermatomal level L1
High volume tap test,Large-volume lumbar puncture assessing gait improvement in NPH
CSF flow void sign,Sagittal T2 flow signal in aqueduct/ventricles in NPH
Callosal angle,Smaller angle on coronal MRI supports iNPH
Wernicke triad,"Confusion, ataxia, ophthalmoplegia due to thiamine deficiency"
Hyperammonemia,Elevated ammonia causing encephalopathy
Uremic encephalopathy,Cognitive and neuromuscular dysfunction in renal failure
Hypoglycemic seizures,Convulsions precipitated by low blood glucose
Left Finger to nose,Dysmetria on finger-to-nose testing more on the left
Left Heel to shin,Ataxia on ipsilateral heel-to-shin test more on the left
Left Rapid alternating movements,Impaired diadochokinesia on fast alternating tasks more on the left
Left Dysdiadochokinesia,Impaired rapid alternating movements from cerebellar dysfunction more on the left
Right Finger to nose,Dysmetria on finger-to-nose testing more on the right
Right Heel to shin,Ataxia on ipsilateral heel-to-shin test more on the right
Right Rapid alternating movements,Impaired diadochokinesia on fast alternating tasks more on the right
Right Dysdiadochokinesia,Impaired rapid alternating movements from cerebellar dysfunction more on the right
Left temporal pole infarct,Ischemia involving the temporal pole on the left
Left insula infarct,Ischemia involving the insula on the left
Left angular gyrus infarct,Ischemia involving the angular gyrus on the left
Left paracentral lobule infarct,Ischemia involving the paracentral lobule on the left
Left precuneus infarct,Ischemia involving the precuneus on the left
Left fusiform gyrus infarct,Ischemia involving the fusiform gyrus on the left
Left lingual gyrus infarct,Ischemia involving the lingual gyrus on the left
Left PCom aneurysm,Aneurysm at the PCom on the left side
Left ACom aneurysm,Aneurysm at the ACom on the left side
Left MCA bifurcation aneurysm,Aneurysm at the MCA on the left side
Right temporal pole infarct,Ischemia involving the temporal pole on the right
Right insula infarct,Ischemia involving the insula on the right
Right angular gyrus infarct,Ischemia involving the angular gyrus on the right
Right paracentral lobule infarct,Ischemia involving the paracentral lobule on the right
Right precuneus infarct,Ischemia involving the precuneus on the right
Right fusiform gyrus infarct,Ischemia involving the fusiform gyrus on the right
Right lingual gyrus infarct,Ischemia involving the lingual gyrus on the right
Right PCom aneurysm,Aneurysm at the PCom on the right side
Right ACom aneurysm,Aneurysm at the ACom on the right side
Right MCA bifurcation aneurysm,Aneurysm at the MCA on the right side
Cavernous sinus thrombosis,Septic thrombosis causing ophthalmoplegia and chemosis
Cerebral venous sinus thrombosis,Headache with papilledema from dural sinus clot
Dural arteriovenous fistula,Abnormal shunt causing pulsatile tinnitus and neuro symptoms
Carotid cavernous fistula,"Traumatic shunt with red eye, bruit, and diplopia"
Pituitary apoplexy,Acute hemorrhage/infarct of pituitary causing headache and vision loss
Temporal arteritis,Giant cell arteritis causing headache and risk of vision loss
Pseudotumor cerebri,Old name for idiopathic intracranial hypertension
Spontaneous intracranial hypotension,Orthostatic headache from CSF leak
Epidural blood patch,Treatment for CSF leak-related orthostatic headache
Orthostatic headache,"Headache worse upright, relieved by lying down"
Ramsay Hunt syndrome,Herpes zoster oticus with facial palsy and ear vesicles
Vestibular migraine,Recurrent vertigo episodes associated with migraine features
Persistent postural perceptual dizziness,Chronic subjective dizziness worsened by visual motion
Mal de debarquement,Persistent rocking sensation after motion exposure
Oscillopsia,Illusion of visual world bouncing from impaired gaze stabilization
Periodic alternating nystagmus,Horizontal nystagmus reversing direction every minutes
Oculogyric crisis,Upward tonic eye deviation from dopamine blockade
Blepharospasm,Involuntary eyelid closure dystonia
Meige syndrome,Cranial dystonia with blepharospasm and oromandibular dystonia
Laryngeal dystonia,Task-specific dysphonia from focal laryngeal dystonia
Cervical dystonia,Torticollis from involuntary neck muscle contractions
Writers cramp,Task-specific hand dystonia during writing
Task specific dystonia,Abnormal muscle activation limited to specific skilled tasks
Functional neurological disorder,Positive-sign based diagnosis of incongruent neurologic symptoms
Hoover sign,Inconsistent hip extension effort indicating functional weakness
Radial tunnel syndrome,Pain and weakness from posterior interosseous nerve compression
Anterior interosseous neuropathy,Weak pinch with intact sensation; branch of median nerve
Posterior interosseous neuropathy,Finger and wrist extension weakness; radial branch
Pronator teres syndrome,Median nerve entrapment in proximal forearm
Erb palsy,Upper trunk brachial plexus palsy with 'waiter's tip' arm
Klumpke palsy,Lower trunk plexus injury with hand weakness; may have Horner syndrome
Adie tonic pupil,Dilated pupil with poor light response and denervation supersensitivity
Argyll Robertson pupil,Small pupils that accommodate but do not react to light
Marcus Gunn pupil,Relative afferent pupillary defect on swinging flashlight test
Light near dissociation,Better constriction to near than to light
MuSK antibody,Muscle-specific kinase antibody in seronegative myasthenia gravis
LRP4 antibody,Low-density lipoprotein receptor-related protein 4 in MG
Thymoma,Anterior mediastinal tumor associated with myasthenia gravis
Single fiber jitter,Increased variability on EMG in neuromuscular junction disorders
Reduced recruitment,"EMG pattern with fewer, larger motor units in neurogenic lesions"
Small fiber skin biopsy,Intraepidermal nerve fiber density test for small fiber neuropathy
Nerve ultrasound,High-resolution imaging for entrapment and neuropathy
Tilt table test,Autonomic evaluation provoking orthostatic symptoms
Valsalva maneuver,Autonomic testing component assessing baroreflex
Leigh syndrome,Subacute necrotizing encephalomyelopathy in infancy
Alpers syndrome,POLG-related epileptic encephalopathy with liver failure
Adrenomyeloneuropathy,Adult-onset X-linked adrenoleukodystrophy with spastic paraparesis
Krabbe disease,Galactocerebrosidase deficiency leukodystrophy
Metachromatic leukodystrophy,Arylsulfatase A deficiency causing demyelination
Alexander disease,GFAP mutation leukodystrophy with Rosenthal fibers
Canavan disease,Aspartoacylase deficiency with spongy leukodystrophy
Pelizaeus Merzbacher,PLP1-related hypomyelinating leukodystrophy
Vanishing white matter disease,eIF2B-related childhood ataxia and hypomyelination
Rett syndrome,MECP2-related neurodevelopmental regression with hand stereotypies
Angelman syndrome,"UBE3A disorder with ataxia, seizures, and laughter"
Niemann Pick type C,Cholesterol trafficking disorder with vertical gaze palsy
Tay Sachs disease,Hexosaminidase A deficiency with cherry-red macula
Subacute combined degeneration,B12 deficiency causing dorsal column and corticospinal dysfunction
Corticobasal degeneration,Asymmetric parkinsonism with apraxia and alien limb
Parkinsonism hyperpyrexia,Life-threatening akinesia and hyperthermia after dopaminergic withdrawal
Neuroleptic malignant syndrome,"Rigidity, hyperthermia, and autonomic instability from dopamine block"
Serotonin syndrome,"Hyperreflexia, clonus, and agitation from serotonergic excess"
Dystonic storm,Severe generalized dystonia with autonomic instability
Super refractory status epilepticus,Seizures persist beyond 24 hours despite anesthetics
NORSE,New-onset refractory status epilepticus of unclear etiology
FIRES,Febrile infection-related epilepsy syndrome
Acute flaccid myelitis,Poliomyelitis-like illness with anterior horn cell involvement
IgG4 pachymeningitis,Hypertrophic dura from IgG4-related disease
CSF leak,Spinal or cranial breach causing low-pressure headaches
Kayser Fleischer ring,Corneal copper deposition in Wilson disease
Posterior communicating artery,Connecting vessel between ICA and PCA
Anterior communicating artery,Vessel connecting the two ACAs
Superior sagittal sinus,Major dural venous sinus along the midline
Transverse sinus,Paired dural venous sinus draining to sigmoid
Sigmoid sinus,Dural venous sinus continuing to internal jugular vein
Cavernous sinus,"Venous plexus around sella with cranial nerves III, IV, V1, V2, VI"
Carotid siphon,Curved intracranial segment of internal carotid artery
Deep cerebral venous system,"Internal cerebral veins, vein of Galen, straight sinus"
Vein of Galen malformation,High-flow neonatal AV shunt causing heart failure and macrocephaly
Pituitary macroadenoma,Large sellar tumor compressing optic chiasm
Optic chiasm compression,Bitemporal field loss from sellar or parasellar mass
Cerebellar tonsillar ectopia,Inferior displacement of tonsils at foramen magnum
Midline shift,Displacement of septum pellucidum from mass effect
Diffuse axonal injury,Traumatic shearing injury with microhemorrhages in white matter
Rancho Los Amigos scale,Ten-level cognitive scale for TBI recovery
Post traumatic amnesia,Interval of memory loss after head injury
Anterior interosseous syndrome,Pure motor median branch palsy with OK sign weakness
Carpal compression test,Manual pressure over carpal tunnel provokes symptoms
Guyon canal syndrome,Ulnar nerve compression at wrist canal
Cubital tunnel syndrome,Ulnar entrapment at the elbow
Radial head subluxation,Nursemaid elbow affecting annular ligament; radial nerve usually spared
Neck tongue syndrome,Transient C2 neuralgia with tongue dysesthesia on neck movement
Brachioradialis reflex,C6-mediated forearm reflex at radial styloid
Patellar reflex,L3–L4 mediated knee jerk
Achilles reflex,S1–S2 mediated ankle jerk
Jaw wobble tremor,Essential tremor manifestation of cranial musculature
Cerebellar rebound,Failure to check movement after resistance is released
Astasia,Inability to maintain upright posture despite normal leg strength
Abasia,Inability to walk despite preserved leg movements while lying
Thalamic pain syndrome,Central post-stroke pain after thalamic injury
Alien hand syndrome,Complex involuntary movements with loss of agency
Central cord hyperextension,Disproportionate arm weakness after cervical injury
Brownout amaurosis,Transient monocular vision loss from retinal ischemia
Amaurosis fugax,Transient monocular blindness usually from carotid emboli
Anterior ischemic optic neuropathy,Pale swollen disc with sudden vision loss
Papillitis,Optic neuritis with disc swelling
Central retinal artery occlusion,Painless monocular vision loss with cherry-red spot
Central retinal vein occlusion,Painless vision loss with 'blood and thunder' fundus
Myerson sign,Persistent glabellar tap blink in Parkinson disease
HINTS plus,HINTS exam with new hearing loss to detect stroke in vertigo
Duke criteria endocarditis,Neurologic embolic strokes part of complications
Heimann Bielschowsky phenomenon,Head tilt in superior oblique palsy to minimize diplopia
Skull base osteomyelitis,Malignant otitis externa causing cranial neuropathies
Lennox Gastaut drop attacks,Atonic seizures causing sudden falls
Juvenile absence epilepsy,Adolescent onset absence with generalized tonic-clonic seizures
Photosensitive epilepsy,Seizures triggered by flashing lights
Startle epilepsy,Reflex seizures precipitated by sudden auditory stimuli
Musicogenic epilepsy,Reflex seizures triggered by specific music
Reflex syncope,Vasovagal faint with prodrome and rapid recovery
Orthostatic syncope,Loss of consciousness from standing due to hypotension
Carotid sinus hypersensitivity,Syncope triggered by neck pressure or tight collars
Postural orthostatic tachycardia,Excessive heart rate rise on standing without hypotension
Neurocardiogenic syncope,Common faint due to autonomic reflex
Paraneoplastic cerebellar degeneration,Subacute ataxia due to antibodies such as anti-Yo
Opsoclonus myoclonus ataxia,Paraneoplastic or post-infectious with chaotic saccades
Episodic ataxia,Brief spells of ataxia often due to channelopathy
Hemiplegic migraine,Migraine with transient unilateral weakness
Sporadic hemiplegic migraine,Hemiplegic migraine without known familial mutation
Familial hemiplegic migraine,CACNA1A-linked migraine with motor aura
Cerebellar cognitive affective,"Syndrome with executive, visuospatial, and affective deficits from cerebellum"
Alien limb phenomenon,Loss of sense of ownership causing unwanted limb movements
Left PICA aneurysm,Saccular dilation of the PICA on the left
Left PICA thrombosis,Occlusive clot in the PICA on the left
Left PICA dissection,Intimal tear of the PICA on the left
Left AICA aneurysm,Saccular dilation of the AICA on the left
Left AICA thrombosis,Occlusive clot in the AICA on the left
