LEFTVERTEBRALSYNDROME,Typical deficits of left Vertebral artery involvement
LEFTVERTEBRALOCCLUSION,Thrombotic or embolic blockage of the left Vertebral artery
RIGHTMCASTROKE,Acute infarct in the right Middle cerebral artery territory
RIGHTMCASYNDROME,Typical deficits of right Middle cerebral artery involvement
RIGHTMCAOCCLUSION,Thrombotic or embolic blockage of the right Middle cerebral artery
RIGHTACASTROKE,Acute infarct in the right Anterior cerebral artery territory
RIGHTACASYNDROME,Typical deficits of right Anterior cerebral artery involvement
RIGHTACAOCCLUSION,Thrombotic or embolic blockage of the right Anterior cerebral artery
RIGHTPCASTROKE,Acute infarct in the right Posterior cerebral artery territory
RIGHTPCASYNDROME,Typical deficits of right Posterior cerebral artery involvement
RIGHTPCAOCCLUSION,Thrombotic or embolic blockage of the right Posterior cerebral artery
RIGHTBASILARSTROKE,Acute infarct in the right Basilar artery territory
RIGHTBASILARSYNDROME,Typical deficits of right Basilar artery involvement
RIGHTBASILAROCCLUSION,Thrombotic or embolic blockage of the right Basilar artery
RIGHTCAROTIDSTROKE,Acute infarct in the right Internal carotid artery territory
RIGHTCAROTIDSYNDROME,Typical deficits of right Internal carotid artery involvement
RIGHTCAROTIDOCCLUSION,Thrombotic or embolic blockage of the right Internal carotid artery
RIGHTVERTEBRALSTROKE,Acute infarct in the right Vertebral artery territory
RIGHTVERTEBRALSYNDROME,Typical deficits of right Vertebral artery involvement
RIGHTVERTEBRALOCCLUSION,Thrombotic or embolic blockage of the right Vertebral artery
THORACICOUTLETSYNDROME,Compression of brachial plexus or subclavian vessels
LONGTHORACICNEUROPATHY,Scapular winging from serratus anterior denervation
SUPRASCAPULARNEUROPATHY,Shoulder pain with infraspinatus weakness
AXILLARYNEUROPATHY,Deltoid weakness after shoulder dislocation
FEMORALNEUROPATHY,Quadriceps weakness with reduced knee jerk
OBTURATORNEUROPATHY,Adductor weakness and medial thigh numbness
SCIATICNEUROPATHY,Weakness below knee with sensory loss posterior leg
TIBIALNEUROPATHY,Plantar flexion weakness; tarsal tunnel entrapment
SURALNEUROPATHY,Lateral foot numbness after ankle injury
LATERALANTEBRACHIALCUTANEOUSNEUROPATHY,Forearm numbness after biceps tendon procedures
BRACHIALNEURITIS,Severe shoulder pain followed by patchy arm weakness
LUMBOSACRALPLEXOPATHY,"Pelvic tumor, diabetes, or radiation causing leg weakness"
DIABETICAMYOTROPHY,Painful proximal leg weakness from diabetic lumbosacral radiculoplexus neuropathy
NERVECONDUCTIONSTUDY,Assesses large myelinated fibers via conduction velocity and amplitudes
ELECTROMYOGRAPHY,Needle exam of muscle to assess denervation and MUAPs
SINGLEFIBEREMG,Highly sensitive test for neuromuscular junction disorders
EVOKEDPOTENTIALS,Electrical responses to sensory stimulation for pathway integrity
AUTONOMICTESTING,"QSART, tilt table, Valsalva for dysautonomia"
C9ORF72,Repeat expansion causing ALS/FTD spectrum
SOD1,Superoxide dismutase gene mutated in familial ALS
HTT,Huntingtin gene with CAG expansion
PMP22,Gene duplicated in CMT1A
GAA,Trinucleotide repeat causing Friedreich ataxia
NOTCH3,Gene mutated in CADASIL small vessel disease
GFAP,Astrocytic intermediate filament; Alexander disease
ARSA,Deficiency in metachromatic leukodystrophy
GALC,Deficiency in Krabbe disease
ABCD1,Adrenoleukodystrophy peroxisomal transporter
POLG,Mitochondrial polymerase mutations causing epilepsy and ataxia
TTR,Transthyretin gene in amyloid neuropathy
CERVICALSPONDYLOTICMYELOPATHY,Gait imbalance and hand clumsiness from cord compression
RADICULOPATHY,Dermatomal pain and weakness from nerve root compression
MYELOPATHY,Spinal cord dysfunction causing long tract signs
SYRINGOMYELIA,Cavitation of spinal cord with cape-like pain/temperature loss
TETHEREDCORD,Low conus with filum thickening; progressive leg symptoms
EPIDURALABSCESS,"Fever, back pain, neurologic deficits; urgent decompression"
SPINALEPIDURALHEMATOMA,Acute cord compression after procedure or anticoagulation
SPINALAVFISTULA,Foix-Alajouanine myelopathy with venous congestion
UHTHOFFPHENOMENON,Worsening of MS symptoms with heat or exercise
HERTWIGMAGENDIE,Downbeat nystagmus with foramen magnum lesions (historical eponym)
SKEWDEVIATION,Vertical ocular misalignment from otolith pathway lesion
OCULARTILTREACTION,Head tilt with ocular torsion from vestibular imbalance
GOWERSIGN,Proximal weakness sign when rising from floor
BABINSKISIGN,Extensor plantar response indicating UMN lesion
CHADDOCKSIGN,Alternative plantar reflex elicitation method
LEFTHEMIANOPIA,Visual field loss on the left half of both eyes
LEFTHEMIPARESIS,Weakness of the left side of the body
LEFTNEGLECT,Inattention to the left side of space
LEFTFACIALPALSY,Lower motor neuron facial weakness on the left
LEFTPRONATORDRIFT,Arm pronates and drifts on the left indicating UMN lesion
LEFTATAXIA,Limb incoordination more on the left
RIGHTHEMIANOPIA,Visual field loss on the right half of both eyes
RIGHTHEMIPARESIS,Weakness of the right side of the body
RIGHTNEGLECT,Inattention to the right side of space
RIGHTFACIALPALSY,Lower motor neuron facial weakness on the right
RIGHTPRONATORDRIFT,Arm pronates and drifts on the right indicating UMN lesion
RIGHTATAXIA,Limb incoordination more on the right
CRANIALNERVE3PALSY,"Deficit with ptosis, 'down and out' eye, and mydriasis"
CRANIALNERVE4PALSY,Deficit with vertical diplopia worse on down gaze
CRANIALNERVE6PALSY,Deficit with horizontal diplopia from impaired abduction
CRANIALNERVE7PALSY,Deficit with facial weakness and loss of taste anterior two-thirds
CRANIALNERVE9PALSY,Deficit with loss of gag and posterior third taste disturbance
CRANIALNERVE10PALSY,Deficit with dysphonia and impaired palate elevation
CRANIALNERVE12PALSY,Deficit with tongue deviation toward lesion on protrusion
DOWNBEATNYSTAGMUS,Fast phase downward; cervicomedullary junction localization
UPBEATNYSTAGMUS,Fast phase upward; medullary localization
GAZEEVOKEDNYSTAGMUS,Increasing on eccentric gaze; cerebellar
OPSOCLONUS,Chaotic multidirectional saccades without intersaccadic intervals
BACLOFEN,GABA-B agonist used for spasticity
TIZANIDINE,Alpha-2 agonist for spasticity
DANTROLENE,Ryanodine receptor blocker reducing muscle contraction
TRIHEXYPHENIDYL,Anticholinergic for tremor in young PD patients
BENZTROPINE,Anticholinergic for parkinsonian tremor
PIMAVANSERIN,5-HT2A inverse agonist for PD psychosis
RIVASTIGMINE,Cholinesterase inhibitor used in dementia
DONEPEZIL,Cholinesterase inhibitor for Alzheimer disease
GALANTAMINE,Cholinesterase inhibitor for Alzheimer disease
MEMANTINE,NMDA antagonist for moderate to severe Alzheimer disease
Broca aphasia,"Nonfluent, effortful speech with relatively spared comprehension"
Wernicke aphasia,Fluent but meaningless speech with impaired comprehension
Conduction aphasia,Impaired repetition with relatively fluent output
Global aphasia,Severe impairment in expression and comprehension
Transcortical motor aphasia,Nonfluent speech with preserved repetition
Transcortical sensory aphasia,Fluent speech with preserved repetition but poor comprehension
Anomic aphasia,Word-finding difficulty with otherwise mild deficits
Left homonymous hemianopia,Loss of left visual field in both eyes
Left superior quadrantanopia,'Left pie in the sky' visual field defect
Left inferior quadrantanopia,'Left pie on the floor' visual field defect
Right homonymous hemianopia,Loss of right visual field in both eyes
Right superior quadrantanopia,'Right pie in the sky' visual field defect
Right inferior quadrantanopia,'Right pie on the floor' visual field defect
Bitemporal hemianopia,Loss of temporal fields from chiasm compression
Binasal hemianopia,"Loss of nasal fields; rare, often ocular cause"
Artery of Percheron infarct,Bilateral paramedian thalamic infarction pattern
Recurrent artery of Heubner,Supplies caudate head and anterior internal capsule
Lenticulostriate infarct,Deep perforator stroke affecting basal ganglia/internal capsule
Anterior choroidal infarct,"Hemiparesis, hemisensory loss, homonymous hemianopia"
Left PICA stroke,Infarct of the PICA territory on the left side
Left PICA infarct,Cerebellar/brainstem ischemia in the PICA distribution
Left PICA syndrome,Characteristic deficits from PICA territory involvement
Left AICA stroke,Infarct of the AICA territory on the left side
Left AICA infarct,Cerebellar/brainstem ischemia in the AICA distribution
Left AICA syndrome,Characteristic deficits from AICA territory involvement
Left SCA stroke,Infarct of the SCA territory on the left side
Left SCA infarct,Cerebellar/brainstem ischemia in the SCA distribution
Left SCA syndrome,Characteristic deficits from SCA territory involvement
Right PICA stroke,Infarct of the PICA territory on the right side
Right PICA infarct,Cerebellar/brainstem ischemia in the PICA distribution
Right PICA syndrome,Characteristic deficits from PICA territory involvement
Right AICA stroke,Infarct of the AICA territory on the right side
Right AICA infarct,Cerebellar/brainstem ischemia in the AICA distribution
Right AICA syndrome,Characteristic deficits from AICA territory involvement
Right SCA stroke,Infarct of the SCA territory on the right side
Right SCA infarct,Cerebellar/brainstem ischemia in the SCA distribution
Right SCA syndrome,Characteristic deficits from SCA territory involvement
Foville syndrome,Medial pontine lesion with gaze palsy and corticospinal signs
Raymond syndrome,Medial pontine infarct with abducens palsy and contralateral hemiparesis
Claude syndrome,Midbrain tegmentum lesion with oculomotor palsy and ataxia
Dejerine syndrome,Medial medullary infarct with contralateral weakness and proprioceptive loss
Locked-in syndrome,Quadriplegia with preserved vertical eye movements and consciousness
Loss of insular ribbon,Early ischemic change on noncontrast head CT
Sulcal effacement,Loss of cortical sulci from edema on CT
Fogging phenomenon,Subacute infarct appears isodense/isointense after several days
Luxury perfusion,Hyperemia of infarcted tissue on perfusion imaging
Empty delta sign,Filling defect in superior sagittal sinus on postcontrast imaging
Hot cross bun sign,Pontine cruciform T2 hyperintensity in multiple system atrophy
Hummingbird sign,Midbrain atrophy pattern in progressive supranuclear palsy
Face of the giant panda,Midbrain T2 pattern in Wilson disease
Pulvinar sign,Thalamic hyperintensity in variant CJD
Hyperperfusion syndrome,Headache and seizures after carotid revascularization
Trail Making Test,Timed test of visual attention and task switching (A/B)
Clock drawing test,Bedside screen for visuospatial and executive dysfunction
Boston Naming Test,Confrontation naming assessment
Digit span,Short-term auditory-verbal memory measure
Stroop test,Assesses selective attention and inhibitory control
Wisconsin Card Sorting Test,Measures set shifting and problem solving
Symbol Digit Modalities,Processing speed test used in MS
Anti Hu,ANNA-1 antibody causing sensory neuronopathy and encephalomyelitis
Anti Yo,PCA-1 antibody associated with paraneoplastic cerebellar degeneration
Anti Ri,ANNA-2 antibody with opsoclonus-myoclonus and ataxia
Anti Ma2,Antibody associated with limbic and diencephalic encephalitis in testicular cancer
Anti CRMP5,Collapsin response mediator protein 5 antibody with neuropathy/encephalitis
Amphiphysin antibody,Paraneoplastic stiff-person syndrome antibody
IgLON5 disease,Sleep disorder with brainstem tauopathy and anti-IgLON5 antibodies
DPPX encephalitis,Antibody-mediated hyperexcitability with diarrhea and weight loss
GABA B encephalitis,Limbic encephalitis with seizures; small-cell lung cancer association
AMPA receptor encephalitis,Limbic encephalitis with memory loss and seizures
GFAP astrocytopathy,Autoimmune meningoencephalomyelitis with radial perivascular enhancement
K complex,EEG waveform seen in stage N2 sleep
Sleep spindle,12–14 Hz bursts in stage N2 sleep
REM atonia,Paralysis of skeletal muscles during REM sleep
Hypnagogic hallucinations,Perceptual experiences at sleep onset
Hypnopompic hallucinations,Perceptual experiences upon awakening
CPAP therapy,Positive airway pressure treatment for obstructive sleep apnea
Tinel sign,"Tapping over a nerve elicits paresthesias (e.g., carpal tunnel)"
Phalen test,Wrist flexion provokes median nerve symptoms
Spurling maneuver,Cervical extension/rotation reproduces radicular pain
Straight leg raise,Supine test stretching L5/S1 nerve roots
Crossed straight leg raise,Contralateral pain indicates large disc herniation
Froment sign,Thumb IP flexion indicates ulnar palsy during pinch
Wartenberg sign,Abducted little finger from ulnar neuropathy
Adson test,Thoracic outlet maneuver reducing radial pulse
Jaw jerk,Masseter reflex; exaggerated in pseudobulbar palsy
Snout reflex,Puckering with tapping philtrum; frontal release sign
Palmomental reflex,Chin muscle twitch with stroking thenar eminence
Grasp reflex,Involuntary grasping with palmar stimulation in frontal lesions
Oppenheim sign,Toe extension with tibial crest stroking; UMN sign
Gordon sign,Great toe extension with calf squeeze; UMN sign
Jendrassik maneuver,Reinforcement technique for deep tendon reflexes
Holmes tremor,Low-frequency rest and action tremor after midbrain lesions
Orthostatic tremor,Fast 13–18 Hz tremor causing unsteadiness on standing
Dystonic tremor,Irregular position-dependent tremor in dystonia
Camptocormia,Marked forward flexion of trunk in Parkinson disease
Pisa syndrome,Lateral trunk flexion in parkinsonism
Freezing of gait,Brief inability to initiate forward stepping in PD
On off phenomenon,Fluctuations between mobility and akinesia in PD
Peak dose dyskinesia,Involuntary movements at levodopa peak effect
Drooling in PD,Sialorrhea due to reduced spontaneous swallowing
Automatisms,Semi-purposeful repetitive behaviors during focal impaired awareness seizures
Gelastic seizures,Laughing spells from hypothalamic hamartoma
Dacrystic seizures,Crying spells as ictal manifestation
Ictal pouting,Chapeau de gendarme sign in frontal lobe epilepsy
Postictal state,Transient confusion or focal deficits after a seizure
Todd paralysis,Transient focal weakness after a seizure
Mesial temporal sclerosis,Hippocampal atrophy and gliosis in temporal lobe epilepsy
Hypothalamic hamartoma,Lesion associated with gelastic seizures and precocious puberty
Focal cortical dysplasia,Developmental cortical malformation causing intractable epilepsy
Periventricular nodular heterotopia,Ectopic gray matter nodules along ventricles
Lissencephaly,Smooth brain with absent or reduced gyri
Pachygyria,"Broad, reduced number of gyri"
Polymicrogyria,Excess small gyri with abnormal cortical lamination
Schizencephaly,Gray matter-lined clefts in cerebral hemispheres
SEEG,Stereoelectroencephalography for invasive seizure localization
Wada test,Intracarotid amobarbital procedure for language/memory lateralization
Responsive neurostimulation,Closed-loop device delivering stimulation at seizure onset
Lewy body,Alpha-synuclein inclusion in neurons
Neurofibrillary tangle,Hyperphosphorylated tau aggregates in Alzheimer disease
Amyloid plaque,Extracellular beta-amyloid deposition
Pick body,Tau-positive cytoplasmic inclusion in frontotemporal dementia
Bunina bodies,Eosinophilic inclusions in motor neurons in ALS
Negri body,Cytoplasmic inclusion in rabies infection
Rosenthal fibers,Eosinophilic astrocytic inclusions in pilocytic astrocytoma
Lafora body,Polyglucosan inclusion in progressive myoclonus epilepsy
TDP 43,Proteinopathy in ALS and FTLD
Holoprosencephaly,Failure of forebrain cleavage with midline facial anomalies
Dandy Walker malformation,Posterior fossa cyst with vermian hypoplasia
Chiari I malformation,Cerebellar tonsillar ectopia below foramen magnum
Chiari II malformation,Hindbrain herniation associated with myelomeningocele
Agenesis of corpus callosum,Absent interhemispheric commissural fibers
Septo optic dysplasia,Optic nerve hypoplasia with midline brain defects
Spinal shock,Flaccid paralysis and areflexia after acute cord injury
Neurogenic shock,Hypotension and bradycardia from autonomic disruption in cord injury
Autonomic dysreflexia,Paroxysmal hypertension with high-level spinal cord lesions
Anterior spinal artery,Midline vessel supplying anterior two-thirds of cord
Posterior spinal artery,Paired vessels supplying dorsal columns
Artery of Adamkiewicz,Major radicular artery feeding thoracolumbar cord
Ewald laws,Describe eye and head movement responses to semicircular canal stimulation
Otolith organs,Utricle and saccule detect linear acceleration and gravity
Benign paroxysmal positional vertigo,Episodic vertigo triggered by head position change
Horizontal canal BPPV,Geotropic or apogeotropic nystagmus on supine roll test
Head thrust test,Corrective saccade for peripheral vestibulopathy
Pseudobulbar affect,Involuntary laughing or crying disproportionate to mood
Bulbar palsy,LMN weakness of cranial nerves IX-XII
Pseudobulbar palsy,UMN dysfunction of corticobulbar pathways
Frontal release signs,Primitive reflexes re-emerging with frontal lobe disease
Capgras syndrome,Delusion that a familiar person is replaced by an imposter
Fregoli syndrome,Delusion that different people are a single person in disguise
Hemisomatognosia,Lack of awareness of one side of the body
Somatoparaphrenia,Belief that a limb does not belong to oneself
Large vessel occlusion,Proximal arterial blockage suitable for thrombectomy
Medium vessel occlusion,Branch occlusion beyond M2/A2/P2 segments
Wake up stroke,Symptoms discovered on awakening with unknown onset time
Hemorrhagic transformation,Bleeding into an ischemic infarct
Cervical artery dissection,Intimal tear in carotid or vertebral artery causing stroke in young
Carotid web,Shelf-like defect in ICA bulb predisposing to emboli
Vasospasm,Delayed arterial narrowing after subarachnoid hemorrhage
Delayed cerebral ischemia,New deficits or infarct after aneurysmal SAH
Nimodipine,Dihydropyridine used to prevent DCI after SAH
Nicardipine,IV calcium-channel blocker for acute BP control in ICH/SAH
Clevidipine,Ultra–short-acting calcium-channel blocker for BP control
ICH score,Grading system predicting mortality in intracerebral hemorrhage
TICI score,Reperfusion grading after thrombectomy
mTICI two b,Successful reperfusion grade in endovascular therapy
ABC over two method,Ellipsoid formula to estimate hematoma volume on CT
RoPE score,Risk of Paradoxical Embolism score in PFO-related stroke
ESUS,Embolic stroke of undetermined source
Patent foramen ovale,Interatrial communication implicated in cryptogenic stroke
Gasserian ganglion,Trigeminal ganglion in Meckel cave
Geniculate ganglion,Facial nerve sensory ganglion in facial canal
Ciliary ganglion,Parasympathetic ganglion for pupil constriction
Otic ganglion,Parasympathetic ganglion to parotid gland via CN IX
Pterygopalatine ganglion,Parasympathetic ganglion to lacrimal and nasal glands
Nucleus ambiguus,Motor nucleus for CN IX and X controlling larynx/pharynx
Nucleus solitarius,Visceral sensory nucleus for taste and baroreception
Edinger Westphal nucleus,Parasympathetic preganglionic nucleus of CN III
Dorsal motor nucleus of vagus,Parasympathetic output to thoracoabdominal viscera
Facial colliculus,Pons floor bump from CN VII fibers looping around CN VI nucleus
Dermatome T2,Upper medial arm and axilla region
Dermatome T3,Upper chest just below clavicles
Dermatome T4,Nipple line dermatome
Dermatome T5,Mid-chest territory
Dermatome T6,Xiphoid level
Dermatome T7,Below xiphoid across the trunk
Dermatome T8,Upper abdomen region
Dermatome T9,Mid-abdomen region
Dermatome T10,Umbilicus dermatome
Dermatome T11,Lower abdomen region
Dermatome T12,Inguinal ligament region
Myotome S2,Knee flexion and plantarflexion contribution
Myotome S3,External anal sphincter function
Myotome S4,Pelvic floor muscles and continence
Myotome S5,Perianal wink reflex contribution
KCNQ2 encephalopathy,Neonatal epileptic encephalopathy due to potassium channel mutation
SCN8A epileptic encephalopathy,Sodium channel-related developmental epileptic encephalopathy
KCNT1 epilepsy,Epilepsy of infancy with migrating focal seizures gene
CACNA1A episodic ataxia,Channelopathy causing EA2 and hemiplegic migraine
PRRT2 mutation,Paroxysmal kinesigenic dyskinesia gene
ATP1A3,Alternating hemiplegia of childhood and rapid-onset dystonia-parkinsonism gene
SLC2A1 deficiency,GLUT1 deficiency causing seizures and movement disorder
AMAN,Acute motor axonal neuropathy variant of Guillain-Barré
AMSAN,Acute motor-sensory axonal neuropathy variant of GBS
POEMS syndrome,"Polyneuropathy with organomegaly, endocrinopathy, M protein, skin changes"
CANOMAD,Chronic ataxic neuropathy with ophthalmoplegia and cold agglutinins
HSAN,Hereditary sensory and autonomic neuropathy group of disorders
Kennedy disease,X-linked spinal and bulbar muscular atrophy
Apnea test,Assessment of brainstem function by CO2 rise without respiratory effort
Oculocephalic reflex,Doll's eyes test for brainstem integrity
Oculovestibular reflex,Cold caloric testing for brainstem function
Cough reflex,Tracheal stimulation response absent in brain death
Corneal reflex,Blink response to corneal touch
MPTP toxicity,Causes parkinsonism via dopaminergic neuron injury
Manganese toxicity,Parkinsonism with T1 hyperintensity in globus pallidus
Nitrous oxide myeloneuropathy,Subacute combined degeneration mimic from B12 inactivation
Lead neuropathy,Motor-predominant neuropathy with wrist/finger drop
Arsenic neuropathy,Painful sensorimotor axonopathy after exposure
Organophosphate poisoning,"Cholinergic crisis with miosis, bronchorrhea, weakness"
Carbon monoxide poisoning,Delayed neurologic sequelae with globus pallidus lesions
Timed Up and Go,"Functional mobility test measuring time to stand, walk, and sit"
Berg Balance Scale,14-item assessment of static and dynamic balance
Constraint induced therapy,Use-dependent rehabilitation after stroke
Festinating gait,"Short, accelerating steps in Parkinson disease"
Wide based gait,Ataxic gait with increased base of support
Steppage gait,High stepping due to foot drop
Magnetic gait,Difficulty initiating steps in normal pressure hydrocephalus
Hashimoto encephalopathy,Steroid-responsive encephalopathy associated with thyroid autoimmunity
CLIPPERS,Pontine perivascular enhancement responsive to steroids
Acute hemorrhagic leukoencephalitis,Fulminant ADEM variant with rapid decline
GFAP antibody,Astrocytic filament antibody in autoimmune meningoencephalomyelitis
Balint syndrome,"Simultanagnosia, optic ataxia, and ocular apraxia"
Simultanagnosia,Inability to perceive more than one object at a time
Optic ataxia,Misreaching for visual targets with intact motor/sensory systems
Ocular apraxia,Difficulty initiating purposeful saccades
Line bisection neglect,Deviated midpoint marking on line bisection in neglect
Cancellation task neglect,Omission of targets on one side during visual search task
PLEDs,Periodic lateralized epileptiform discharges on EEG
GPEDs,Generalized periodic epileptiform discharges
Burst suppression,Alternating high-voltage bursts and flat intervals on EEG
Triphasic waves,EEG pattern seen in metabolic encephalopathy
Photoparoxysmal response,Spike-wave discharges triggered by photic stimulation
3 Hz spike and wave,Classic absence seizure EEG pattern
Hypsarrhythmia,Chaotic high-amplitude pattern in infantile spasms
Gamma Knife,Stereotactic radiosurgery device using cobalt-60 beams
CyberKnife,Robotic stereotactic radiotherapy system
Hemicraniectomy,Decompressive removal of skull flap for malignant edema
Cranioplasty,Repair of skull defect after craniectomy
Inferior cerebellar peduncle,Restiform body carrying afferents to cerebellum
Superior colliculus,Tectal structure mediating saccades and visual orientation
Inferior colliculus,Auditory midbrain relay nucleus
Medial longitudinal fasciculus,Brainstem tract coordinating eye movements and vestibular input
Pretectal area,Midbrain region mediating pupillary light reflex
Anterior commissure,Fiber tract connecting temporal lobes
Posterior commissure,Fiber tract near pineal region linked to vertical gaze
GABA A receptor,Ligand-gated chloride channel targeted by benzodiazepines
GABA B receptor,Metabotropic receptor targeted by baclofen
NMDA receptor,Glutamate receptor with voltage-dependent Mg2+ block
AMPA receptor,Ionotropic glutamate receptor mediating fast excitatory transmission
Nicotinic acetylcholine receptor,Ligand-gated ion channel at neuromuscular junction
Ophthalmic division,V1 branch of trigeminal nerve
Maxillary division,V2 branch of trigeminal nerve
Mandibular division,V3 branch of trigeminal nerve
Chorda tympani,Branch of facial nerve carrying taste and parasympathetics
Greater petrosal nerve,Facial nerve branch to pterygopalatine ganglion
Nervus intermedius,Sensory/parasympathetic component of facial nerve
Left gaze deviation,Eyes deviated toward the left in frontal eye field lesion
Left neglect on extinction,Failure to detect stimuli on the left with double simultaneous stimulation
Left sensory level at T10,Pinprick diminished below umbilicus on the left side
Right gaze deviation,Eyes deviated toward the right in frontal eye field lesion
Right neglect on extinction,Failure to detect stimuli on the right with double simultaneous stimulation
Right sensory level at T10,Pinprick diminished below umbilicus on the right side
A3 segment,Pericallosal segment of anterior cerebral artery beyond A2
M3 segment,Opercular branches of middle cerebral artery
M4 segment,Cortical branches of middle cerebral artery
P3 segment,Quadrigeminal segment of posterior cerebral artery
P4 segment,Posterior cerebral artery calcarine branches
Fetal origin PCA,Posterior cerebral artery arises from internal carotid via PCom
Left thalamic stroke,Infarct predominantly affecting the thalamic region on the left
Left capsular stroke,Infarct predominantly affecting the capsular region on the left
