APHASIA,Language impairment after dominant hemisphere lesion
DYSMETRIA,Past pointing on finger-to-nose test from cerebellar dysfunction
HEMIBALLISMUS,Violent flinging limb movements due to subthalamic nucleus lesion
HEMIPARESIS,Weakness of one side of the body
ASTEREOGNOSIS,Inability to identify objects by touch with intact primary sensation
AGRAPHIA,Loss of the ability to write
ALEXIA,Acquired inability to read
ANOSOGNOSIA,Unawareness of one's own neurologic deficits
ATAXIA,Uncoordinated gait or limb movements
DYSARTHRIA,Motor speech disorder with slurred or effortful speech
DYSTONIA,Sustained or intermittent muscle contractions causing abnormal postures
MYOCLONUS,"Sudden, brief, shock-like muscle jerks"
TREMOR,Rhythmic oscillatory movement at rest or with action
NYSTAGMUS,Repetitive involuntary eye movements
VERTIGO,Illusory sense of motion from vestibular dysfunction
MIGRAINE,Recurrent headache often with photophobia; aura may occur
EPILEPSY,Tendency for recurrent unprovoked seizures
AURA,Transient focal symptoms preceding a seizure or migraine
GERSTMANN,"Agraphia, acalculia, finger agnosia, and left-right disorientation syndrome"
BABINSKI,Upgoing plantar response indicating corticospinal tract dysfunction
APHONIA,Loss of voice due to laryngeal or central causes
APRAXIA,Inability to perform learned motor tasks despite intact strength
AGNOSIA,Failure to recognize objects despite preserved sensation
PROSOPAGNOSIA,Inability to recognize familiar faces
HEMINEGLECT,"Failure to attend to one side of space, usually left"
HEMIANOPIA,Loss of half of the visual field
QUADRANTANOPIA,Loss of a quarter of the visual field
SCOTOMA,Focal area of visual field loss
DIPLOPIA,Double vision
PTOSIS,Drooping of the upper eyelid
MIOSIS,Pupillary constriction
MYDRIASIS,Pupillary dilation
ANISOCORIA,Unequal pupil sizes
HORNERSYNDROME,"Ptosis, miosis, anhidrosis from sympathetic pathway lesion"
INTERNUCLEAROPHTHALMOPLEGIA,Impaired adduction with abducting nystagmus from MLF lesion
ONEANDAHALFSYNDROME,Ipsilateral gaze palsy with contralateral INO
PARINAUDSYNDROME,Dorsal midbrain syndrome with upgaze palsy and light-near dissociation
MILLERFISHER,"Ataxia, areflexia, ophthalmoplegia variant of GBS"
WALLENBERG,Lateral medullary infarct syndrome
WEBERSYNDROME,Midbrain stroke with ipsilateral CN III palsy and contralateral weakness
BENEDIKT,Midbrain tegmentum syndrome with oculomotor palsy and tremor
BROWNSEQUARD,Hemisection of spinal cord causing ipsilateral weakness and contralateral pain loss
ANTERIORCORDSYNDROME,Loss of motor and pain/temperature with preserved dorsal columns
CENTRALCORDSYNDROME,Upper limb weakness greater than legs after cervical hyperextension
POSTERIORCORDSYNDROME,Loss of vibration and proprioception with preserved pain and temperature
CAUDAEQUINA,"Radicular pain, asymmetric weakness, saddle anesthesia, bladder involvement"
CONUSMEDULLARIS,"Symmetric weakness, early sphincter dysfunction, perianal anesthesia"
CORTICOSPINALTRACT,Descending motor pathway from cortex to spinal cord
SPINOTHALAMICTRACT,Ascending pain and temperature pathway
DORSALCOLUMNS,Ascending vibration and proprioception pathway
SUBTHALAMICNUCLEUS,Lesion here causes hemiballismus
BASALGANGLIA,Deep nuclei modulating movement initiation and inhibition
GLOBUSPALLIDUSINTERNUS,Target of deep brain stimulation for dystonia
SUBSTANTIANIGRA,Dopaminergic midbrain nucleus degenerated in Parkinson disease
REDNUCLEUS,Midbrain structure associated with rubral tremor
LOCUSCOERULEUS,Pontine norepinephrine nucleus linked to arousal
CEREBELLARPEDUNCLES,Fiber bundles connecting cerebellum to brainstem
VERMIS,Midline cerebellar structure; lesion causes truncal ataxia
FLOCCULUS,Cerebellar region for vestibulo-ocular reflex calibration
PURKINJECELL,Principal inhibitory neuron of cerebellar cortex
OLFACTORYNERVE,Cranial nerve I for smell
OPTICNERVE,Cranial nerve II for vision
OCULOMOTORNERVE,Cranial nerve III for eye movements and pupil constriction
TROCHLEARNERVE,Cranial nerve IV innervating superior oblique
TRIGEMINALNERVE,Cranial nerve V for facial sensation and mastication
ABDUCENSNERVE,Cranial nerve VI innervating lateral rectus
FACIALNERVE,Cranial nerve VII for facial expression and taste anterior two-thirds
VESTIBULOCOCHLEARNERVE,Cranial nerve VIII for hearing and balance
GLOSSOPHARYNGEALNERVE,Cranial nerve IX for taste posterior third and pharynx
VAGUSNERVE,Cranial nerve X for parasympathetic innervation and larynx
ACCESSORYNERVE,Cranial nerve XI for sternocleidomastoid and trapezius
HYPOGLOSSALNERVE,Cranial nerve XII for tongue movement
PARKINSONDISEASE,"Bradykinesia, rigidity, rest tremor, postural instability"
MULTIPLESYSTEMATROPHY,Atypical parkinsonism with early autonomic failure or cerebellar signs
PROGRESSIVESUPRANUCLEARPALSY,Vertical gaze palsy with early falls and axial rigidity
CORTICOBASALSYNDROME,Asymmetric apraxia and cortical sensory loss with parkinsonism
ESSENTIALTREMOR,Action tremor improved by alcohol; familial
HUNTINGTONDISEASE,Autosomal dominant chorea with CAG expansion
WILSONDISEASE,Copper metabolism disorder with movement and hepatic involvement
DOPARESPONSIVEDYSTONIA,Childhood-onset dystonia improved with levodopa
TOURETTESYNDROME,Motor and vocal tics before age 18
AKATHISIA,Subjective inner restlessness with need to move
BRADYKINESIA,Slowness of movement; cardinal feature of parkinsonism
RIGIDITY,Velocity-independent resistance to passive movement
CHOREA,"Random, flowing, dance-like movements"
BALLISM,"Flinging, proximal movements; severe form of chorea"
TIC,"Sudden, stereotyped, suppressible movement or sound"
SPASTICITY,Velocity-dependent increase in muscle tone
FLACCIDPARALYSIS,Hypotonia and areflexia from lower motor neuron lesion
FASCICULATION,Visible spontaneous muscle fiber twitch
MYOTONIA,Delayed relaxation after contraction; grip myotonia
NEUROMYOTONIA,Continuous muscle fiber activity; Isaacs syndrome
MYASTHENIAGRAVIS,Fluctuating fatigable weakness; ACh receptor antibodies
LAMBERTEATON,Proximal weakness improves with exercise; P/Q calcium channel antibodies
GUILLAINBARRE,Acute inflammatory demyelinating polyradiculoneuropathy
CIDP,Chronic inflammatory demyelinating polyneuropathy
MMN,Multifocal motor neuropathy with conduction block
ALS,Combined upper and lower motor neuron degeneration
SMA,Genetic anterior horn cell disease; SMN1 deletions
CARPALTUNNEL,Median neuropathy at the wrist causing nocturnal paresthesias
ULNARNEUROPATHY,Entrapment at elbow causing numb 4th/5th digits
RADIALNEUROPATHY,Wrist drop after compression in spiral groove
PERONEALNEUROPATHY,Foot drop from fibular head entrapment
TARSALTUNNEL,Posterior tibial nerve entrapment at the ankle
MERALGIAPARESTHETICA,Lateral femoral cutaneous nerve entrapment
SMALLFIBERNEUROPATHY,Burning pain with preserved strength and reflexes
DEMYELINATINGNEUROPATHY,Slowed conduction with prolonged distal latencies
AXONALNEUROPATHY,Low amplitudes with relatively preserved velocities on NCS
TRIGEMINALNEURALGIA,Lancinating facial pain triggered by light touch
GLOSSOPHARYNGEALNEURALGIA,Throat/ear pain triggered by swallowing
HEMIFACIALSPASM,Involuntary unilateral facial contractions from vascular loop
BELLPALSY,Acute LMN facial palsy; idiopathic
CLUSTERHEADACHE,Severe orbital pain with autonomic features; circadian
PAROXYSMALHEMICRANIA,"Short unilateral headaches, indomethacin responsive"
SUNCT,Short-lasting unilateral neuralgiform headache with conjunctival injection and tearing
SUNA,Short-lasting unilateral neuralgiform headache with autonomic symptoms
HEMICRANIACONTINUA,"Continuous unilateral headache, indomethacin responsive"
STATUSMIGRAINOSUS,Migraine lasting >72 hours
MEDICATIONOVERUSEHEADACHE,Chronic daily headache due to frequent analgesic use
CEREBRALVENOUSTHROMBOSIS,Headache with papilledema; MRV shows sinus occlusion
SUBARACHNOIDHEMORRHAGE,Thunderclap headache from ruptured aneurysm
INTRACEREBRALHEMORRHAGE,Lobar or deep bleed; hypertension common cause
EPIDURALHEMATOMA,Lens-shaped collection after temporal bone fracture
SUBDURALHEMATOMA,Crescent-shaped collection; bridging veins
CEREBRALAMYLOIDANGIOPATHY,Lobar hemorrhage in elderly with microbleeds on MRI
ARTERIOVENOUSMALFORMATION,Congenital shunt causing hemorrhage or seizures
CAVERNOUSMALFORMATION,Mulberry lesion with hemosiderin rim on MRI
ISCHEMICSTROKE,Focal deficit from arterial occlusion
LACUNARINFARCT,Small deep infarct from lipohyalinosis
WATERSHEDINFARCT,Borderzone ischemia between arterial territories
HYPERDENSEMCASIGN,Noncontrast CT clue of acute thrombus in M1
DENSEBASILARSIGN,Hyperattenuated basilar artery on CT indicating thrombosis
DOTSIGN,Thrombosed M2 branch seen as hyperdense dot on CT
ASPECTS,Ten-point CT score for early ischemia in MCA territory
NIHSS,Standardized scale to quantify stroke severity
MRS,Modified Rankin Scale for disability after stroke
TPA,Alteplase thrombolysis for acute ischemic stroke
TENECTEPLASE,Fibrin-specific thrombolytic used off-label for stroke
THROMBECTOMY,Endovascular clot retrieval for large vessel occlusion
PERFUSIONMISMATCH,CT/MR penumbra-core imbalance guiding therapy
OSMOTICDEMYELINATION,Central pontine/extrapontine myelinolysis after rapid sodium correction
WERNICKEENCEPHALOPATHY,"Thiamine deficiency with confusion, ataxia, ophthalmoplegia"
KORSAKOFF,Amnestic syndrome with confabulation after thiamine deficiency
MARCHIAFAVABIGNAMI,Corpus callosum demyelination in alcohol misuse
HEPATICENCEPHALOPATHY,Cognitive slowing from hyperammonemia
HYPOXICISCHEMICINJURY,Global anoxic brain injury after cardiac arrest
POSTERIORREVERSIBLEENCEPHALOPATHY,"Headache, seizures, visual loss with vasogenic edema"
REVERSIBLECEREBRALVASOCONSTRICTION,Recurrent thunderclap headaches with segmental narrowing
MELAS,Mitochondrial encephalomyopathy with lactic acidosis and stroke-like episodes
MERRF,Myoclonic epilepsy with ragged red fibers
LHON,Leber hereditary optic neuropathy causing subacute visual loss
CANVAS,"Cerebellar ataxia, neuropathy, vestibular areflexia syndrome"
FRAGILEXTREMORATAXIA,Late-onset tremor/ataxia from FMR1 premutation
FAHRDISEASE,Basal ganglia calcifications with movement disorder
NEUROACANTHOCYTOSIS,Chorea with acanthocytes on smear
CREUTZFELDTJAKOB,Rapidly progressive dementia with myoclonus; 14-3-3 on CSF
ALZHEIMERDISEASE,Gradual amnestic dementia with medial temporal atrophy
LEWYBODYDEMENTIA,"Fluctuations, visual hallucinations, parkinsonism"
FRONTOTEMPORALDEMENTIA,Early behavioral change or language variant
PRIMARYPROGRESSIVEAPHASIA,"Gradual loss of language; nonfluent, semantic, or logopenic"
NORMALPRESSUREHYDROCEPHALUS,"Gait, cognition, urinary incontinence with enlarged ventricles"
HYDROCEPHALUS,Enlarged ventricles from CSF imbalance
IDIOPATHICINTRACRANIALHYPERTENSION,Headache with papilledema in obese woman of childbearing age
PAPILLEDEMA,Optic disc swelling from raised intracranial pressure
OPTICNEURITIS,Painful subacute monocular visual loss
UHTOFF,Worsening of neurologic symptoms with heat in MS
LHERMITTESIGN,Electric shock sensation with neck flexion
MULTIPLESCLEROSIS,Immune-mediated demyelinating disease with dissemination in time and space
NEUROMYELITISOPTICA,AQP4-IgG astrocytopathy with longitudinal cord lesions
MOGANTIBODYDISEASE,Inflammatory demyelination targeting myelin oligodendrocyte glycoprotein
TRANSVERSEMYELITIS,Subacute spinal cord inflammation causing sensory level and weakness
ACUTEDISSEMINATEDENCEPHALOMYELITIS,Postinfectious demyelination in children
ADEM,Abbreviation for acute disseminated encephalomyelitis
BICKERSTAFFENCEPHALITIS,Brainstem encephalitis with ataxia and ophthalmoplegia
ANTINMDARECEPTOR,Autoimmune encephalitis with psychiatric symptoms and dyskinesias
LGI1ENCEPHALITIS,Faciobrachial dystonic seizures with hyponatremia
CASPR2ENCEPHALITIS,Autoimmune limbic encephalitis with peripheral nerve hyperexcitability
GAD65ENCEPHALITIS,Autoimmune epilepsy; may cause limbic encephalitis
STIFFPERSONSYNDROME,GAD antibodies with axial rigidity and spasms
OPSOCLONUSMYOCLONUS,Chaotic saccades with myoclonus and ataxia
INFANTILESPASMS,West syndrome with hypsarrhythmia on EEG
WESTSYNDROME,"Infantile spasms, hypsarrhythmia, developmental regression"
LENNOXGASTAUT,Childhood epileptic encephalopathy with multiple seizure types
DRAVET,Severe myoclonic epilepsy of infancy; SCN1A variants
OHTAHARA,Early infantile epileptic encephalopathy
LANDAUKLEFFNER,Acquired epileptic aphasia of childhood
BENIGNROLANDICEPILEPSY,Centrotemporal spikes with nocturnal facial motor seizures
JUVENILEMYOCLONICEPILEPSY,Myoclonic jerks after awakening; good valproate response
ABSENCEEPILEPSY,Brief staring spells with 3 Hz spike-and-wave
TEMPORALLOBEEPILEPSY,Focal impaired awareness seizures with déjà vu and automatisms
STATUSEPILEPTICUS,Seizure lasting >5 minutes or recurrent without recovery
EEG,Electroencephalography; records cortical electrical activity
MEG,Magnetoencephalography; measures magnetic fields from neuronal currents
PET,Positron emission tomography for metabolism or receptor imaging
SPECT,Perfusion imaging used in ictal epilepsy localization
DATSCAN,Nigrostriatal dopamine transporter imaging
LUMBARPUNCTURE,Needle CSF access at L3-4 or L4-5 interspace
OPENINGPRESSURE,First CSF pressure measured at lumbar puncture
XANTHOCHROMIA,Yellow CSF supernatant after hemorrhage
OLIGOCLONALBANDS,CSF-restricted IgG bands suggestive of MS
ALBUMINOCYTOLOGICDISSOCIATION,High CSF protein with normal cell count in GBS
FRONTALLOBE,"Executive function, motor planning; precentral gyrus motor strip"
PARIETALLOBE,Somatosensory integration; postcentral gyrus sensory strip
TEMPORALLOBE,Audition and memory; hippocampus and amygdala reside here
OCCIPITALLOBE,Primary visual cortex region
INSULA,Hidden cortical region for interoception and gustation
HIPPOCAMPUS,Medial temporal memory structure; vulnerable to hypoxia
AMYGDALA,Limbic nucleus for emotion and fear conditioning
THALAMUS,Relay hub for sensory and motor information
HYPOTHALAMUS,Autonomic and endocrine master regulator
BASALFOREBRAIN,Cholinergic nuclei important for attention and memory
PINEALGLAND,Melatonin-secreting structure causing Parinaud syndrome when enlarged
PITUITARYGLAND,Endocrine master gland; macroadenomas can compress chiasm
MIDBRAIN,Mesencephalon; location of red nucleus and substantia nigra
PONS,Bridge containing cranial nerve nuclei V–VIII
MEDULLA,Contains vital centers for breathing and heart rate
CEREBELLUM,Coordinates movement and balance
DENTATENUCLEUS,Largest deep cerebellar nucleus; output to thalamus
FORAMENMAGNUM,Opening through which medulla transitions to cord; herniation risk
CORPUSCALLOSUM,Major commissural fiber tract connecting hemispheres
INTERNALCAPSULE,Posterior limb carries corticospinal tract fibers
CORONARADIATA,Fan-like white matter above internal capsule
FORNIX,Efferent pathway from hippocampus to mammillary bodies
MAMILLARYBODIES,Memory relay structures damaged in thiamine deficiency
CALCARINECORTEX,Primary visual cortex along calcarine sulcus
BROCAAREA,Inferior frontal gyrus region for speech production
WERNICKEAREA,Posterior superior temporal gyrus for language comprehension
ANGULARGYRUS,Parietal region implicated in Gerstmann syndrome
SUPRAMARGINALGYRUS,Parietal lobe region for phonologic processing
PRECENTRALGYRUS,Primary motor cortex
POSTCENTRALGYRUS,Primary somatosensory cortex
ARCUATEFASCICULUS,White matter tract linking Broca and Wernicke areas
MEYERLOOP,Temporal optic radiations causing superior quadrantanopia when lesioned
BAUMLOOP,Parietal optic radiations causing inferior quadrantanopia when lesioned
SUBARACHNOIDSPACE,CSF-filled compartment between arachnoid and pia
CHOROIDPLEXUS,CSF-producing epithelium within ventricles
AQUEDUCTOFSYLVIUS,Cerebral aqueduct connecting third and fourth ventricles
FOURTHVENTRICLE,Ventricular cavity dorsal to pons and medulla
LATERALVENTRICLE,C-shaped ventricular compartments in each hemisphere
BASALGANGLIACIRCUITS,Direct and indirect pathways modulate movement
NUCLEUSACCUMBENS,Ventral striatum involved in reward
PUTAMEN,Lateral basal ganglia nucleus; motor functions
CAUDATENUCLEUS,Head atrophy causes boxcar ventricles in Huntington disease
GLOBUSPALLIDUSEXTERNUS,Part of indirect pathway for movement inhibition
FLAIR,MRI sequence suppressing CSF to highlight T2 lesions
DWI,MRI sequence sensitive to restricted diffusion in acute stroke
ADC,Map inverse to DWI; low values in acute infarct
SWI,MRI sequence highlighting susceptibility from blood or iron
GRE,Gradient echo sequence; sensitive to microbleeds
MRA,Noninvasive MR angiography of vessels
CTA,CT angiography visualizing arterial lumen and thrombus
CTPERFUSION,Dynamic imaging to estimate core and penumbra
VESSELWALLMRI,High-resolution imaging of intracranial vasculitis or plaque
CAROTIDULTRASOUND,Duplex study for stenosis and plaque
TRANSCRANIALDOPPLER,Ultrasound assessing intracranial velocities and shunts
EEGMONTAGE,Arrangement of electrodes for scalp recording
MEP,Motor evoked potential assessing corticospinal tract
SSEP,Somatosensory evoked potential for dorsal column pathways
SUMATRIPTAN,Serotonin 5-HT1B/1D agonist for acute migraine
RIZATRIPTAN,Fast-acting triptan for acute migraine
ZOLMITRIPTAN,Triptan available as nasal spray for migraine
NARATRIPTAN,Longer-acting triptan used for menstrual migraine
FROVATRIPTAN,Long half-life triptan helpful for prolonged attacks
LASMIDITAN,Selective 5-HT1F agonist for acute migraine without vasoconstriction
UBROGEPANT,Oral CGRP receptor antagonist for acute migraine
RIMEGEPANT,Gepant used acutely and preventively for migraine
ATOGEPANT,Oral CGRP antagonist for preventive migraine therapy
ERENUMAB,Monoclonal antibody targeting CGRP receptor for prevention
FREMANEZUMAB,Anti-CGRP monoclonal antibody for prevention
GALCANEZUMAB,Anti-CGRP monoclonal antibody for prevention
EPTINEZUMAB,IV anti-CGRP monoclonal antibody for prevention
DIHYDROERGOTAMINE,Ergot derivative for status migrainosus
PROPRANOLOL,Beta blocker used for migraine prevention
TOPIRAMATE,Antiepileptic effective for migraine prevention
VALPROATE,Antiepileptic used for migraine prevention; teratogenic
AMITRIPTYLINE,Tricyclic antidepressant for migraine prevention
ONABOTULINUMTOXINA,Botox injections for chronic migraine prevention
LEVETIRACETAM,Broad-spectrum antiseizure drug; irritability side effect
BRIVARACETAM,SV2A ligand similar to levetiracetam
LACOSAMIDE,Enhances slow inactivation of sodium channels
LAMOTRIGINE,Sodium channel blocker; risk of rash if titrated fast
CARBAMAZEPINE,Sodium channel blocker; induces hyponatremia
OXCARBAZEPINE,Related to carbamazepine with less enzyme induction
ESLICARBAZEPINE,Once-daily sodium channel blocker
ZONISAMIDE,Sulfonamide with carbonic anhydrase inhibition; kidney stones
PERAMPANEL,AMPA receptor antagonist; behavior changes
PHENOBARBITAL,Barbiturate used in neonatal seizures
PHENYTOIN,Zero-order kinetics; nystagmus and ataxia with toxicity
FOSPHENYTOIN,Prodrug of phenytoin for IV loading
CLOBAZAM,Benzodiazepine used in Lennox-Gastaut
CLONAZEPAM,Benzodiazepine for myoclonus and absence variants
DIAZEPAM,Rescue benzodiazepine for seizures
MIDAZOLAM,Intranasal or IM benzodiazepine for status epilepticus
GABAPENTIN,Alpha-2-delta ligand for focal seizures and neuropathic pain
PREGABALIN,Alpha-2-delta ligand for neuropathic pain; adjunct in seizures
TIAGABINE,GABA reuptake inhibitor; risk of nonconvulsive status
VIGABATRIN,Irreversible GABA transaminase inhibitor; visual field loss
FELBAMATE,NMDA antagonist with aplastic anemia risk
RUFINAMIDE,Prolongs sodium channel inactivation; used in LGS
CANNABIDIOL,Approved for Dravet and Lennox-Gastaut
STIRIPENTOL,Adjunct for Dravet syndrome with clobazam
FENFLURAMINE,Serotonergic agent for Dravet syndrome
CARBIDOPALEVODOPA,Dopamine precursor with peripheral decarboxylase inhibitor
PRAMIPEXOLE,Dopamine agonist; impulse control risk
ROPINIROLE,Dopamine agonist for Parkinson disease
ROTIGOTINE,Transdermal dopamine agonist patch
AMANTADINE,NMDA antagonist helpful for dyskinesias
SELEGILINE,MAO-B inhibitor; adjunct in early PD
RASAGILINE,MAO-B inhibitor for symptomatic benefit
SAFINAMIDE,Reversible MAO-B inhibitor with glutamate effects
ENTACAPONE,COMT inhibitor extending levodopa effect
TOLCAPONE,COMT inhibitor; hepatotoxicity risk
OPICAPONE,Once-daily COMT inhibitor
INHALEDLEVODOPA,Rescue therapy for OFF episodes
DEEPBRAINSTIMULATION,Surgical therapy targeting STN or GPi
INTERFERONBETA,Injectable therapy for relapsing MS
GLATIRAMERACETATE,Co-polymer injection for relapsing MS
DIMETHYLFUMARATE,Oral fumarate; lymphopenia risk
DIROXIMELFUMARATE,Newer fumarate with GI tolerability
TERIFLUNOMIDE,Oral pyrimidine synthesis inhibitor; teratogenic
FINGOLIMOD,S1P modulator; first-dose bradycardia monitoring
SIPONIMOD,S1P modulator approved for SPMS
OZANIMOD,S1P modulator with less bradycardia
NATALIZUMAB,Anti-α4 integrin; PML risk stratified by JCV
OCRELIZUMAB,Anti-CD20 monoclonal antibody; PPMS and RRMS
OFATUMUMAB,Self-injected anti-CD20 for RRMS
RITUXIMAB,Off-label anti-CD20 used in MS/NMOSD
CLADRIBINE,Oral purine analog immune reconstitution therapy
ALEMTUZUMAB,Anti-CD52 monoclonal; autoimmune risks
ECULIZUMAB,Complement inhibitor approved for AQP4+ NMOSD
INEBILIZUMAB,Anti-CD19 monoclonal for NMOSD
SATRALIZUMAB,IL-6 receptor blocker for NMOSD
IVIG,Intravenous immunoglobulin used in CIDP and MG exacerbations
PLASMAPHERESIS,Apheresis removing pathogenic antibodies
GLIOBLASTOMA,IDH-wildtype WHO grade 4 astrocytic tumor
ASTROCYTOMA,Glial neoplasm from astrocytes; graded by WHO criteria
OLIGODENDROGLIOMA,"IDH mutant, 1p/19q codeleted diffuse glioma"
EPENDYMOMA,Tumor of ependymal cells lining ventricles
MEDULLOBLASTOMA,Embryonal posterior fossa tumor in children
MENINGIOMA,Extra-axial dural-based tumor; often benign
SCHWANNOMA,Peripheral nerve sheath tumor; Antoni A/B areas
VESTIBULARSCHWANNOMA,CP angle tumor causing unilateral hearing loss
NEUROFIBROMA,Peripheral nerve tumor; plexiform type in NF1
HEMANGIOBLASTOMA,Highly vascular cerebellar tumor; VHL associated
CRANIOPHARYNGIOMA,Suprasellar cystic tumor; bitemporal hemianopia
PINEOBLASTOMA,Malignant pineal region tumor
CHORDOMA,Midline notochordal tumor at clivus or sacrum
PITUITARYADENOMA,Hormone secreting or nonfunctioning sellar tumor
MENINGEALCARCINOMATOSIS,Leptomeningeal spread of systemic cancer
PRIMARYCNSLYMPHOMA,Enhancing periventricular lesions; steroid sensitive
HERPESENCEPHALITIS,Temporal lobe encephalitis from HSV-1
VARICELLAZOSTERVASCULOPATHY,Stroke after shingles due to vessel inflammation
PROGRESSIVEMULTIFOCALLEUKOENCEPHALOPATHY,JC virus demyelination in immunosuppressed
NEUROCYSTICERCOSIS,Parasitic brain infection with ring-enhancing lesions
TOXOPLASMOSIS,Multiple ring-enhancing lesions in AIDS
CRYPTOCOCCALMENINGITIS,CSF with high opening pressure and positive antigen
TUBERCULOUSMENINGITIS,Basilar meningeal enhancement with cranial neuropathies
LISTERIAMENINGITIS,Gram-positive rod; consider in elderly and immunocompromised
LYMENEUROBORRELIOSIS,Facial palsy or meningitis after tick exposure
NEUROSYPHILIS,Tabes dorsalis or general paresis; positive CSF VDRL
WESTNILEENCEPHALITIS,Flaccid paralysis with anterior horn cell involvement
ENTEROVIRALMENINGITIS,Self-limited aseptic meningitis in summer/fall
AUTOIMMUNEENCEPHALITIS,Antibody-mediated limbic dysfunction with seizures
NARCOLEPSY,Excessive daytime sleepiness with SOREMPs on MSLT
CATAPLEXY,Emotion-triggered loss of muscle tone in narcolepsy type 1
REMBEHAVIORDISORDER,Dream enactment due to loss of atonia
SLEEPAPNEA,Repetitive upper airway obstruction causing daytime sleepiness
RESTLESSLEGS,Urge to move legs worse at rest and evening
ORTHOSTATICHYPOTENSION,Drop in blood pressure on standing causing lightheadedness
POTS,Excessive heart rate increase on standing without hypotension
MULTIPLESYSTEMATROPHYCEREBELLAR,MSA-C variant with gait ataxia
MULTIPLESYSTEMATROPHYPARKINSONIAN,MSA-P variant with bradykinesia and rigidity
GLASGOWCOMASCALE,"Eye, verbal, motor score for consciousness assessment"
FOURSCORE,Alternative coma scale including brainstem and respiration
HUNTANDHESS,Subarachnoid hemorrhage clinical grading scale
FISHERSCALE,CT blood grading for SAH vasospasm risk
ABCD2,TIA risk stratification score
CHA2DS2VASC,Atrial fibrillation stroke risk score
HASBLED,Bleeding risk score in anticoagulation
ROMBERG,Sway with eyes closed indicates proprioceptive loss
HOFFMANNSIGN,Finger flexion with flicking nail suggests UMN lesion
KERNIGSIGN,Hamstring pain/resistance with knee extension in meningitis
BRUDZINSKISIGN,Hip/knee flexion with neck flexion in meningitis
HINTSEXAM,"Head impulse, nystagmus, test of skew for acute vestibular syndrome"
EPLEYMANEUVER,Canalith repositioning for posterior canal BPPV
DIXHALLPIKE,Provocative test for posterior canal BPPV
LEFTMCASTROKE,Acute infarct in the left Middle cerebral artery territory
LEFTMCASYNDROME,Typical deficits of left Middle cerebral artery involvement
LEFTMCAOCCLUSION,Thrombotic or embolic blockage of the left Middle cerebral artery
LEFTACASTROKE,Acute infarct in the left Anterior cerebral artery territory
LEFTACASYNDROME,Typical deficits of left Anterior cerebral artery involvement
LEFTACAOCCLUSION,Thrombotic or embolic blockage of the left Anterior cerebral artery
LEFTPCASTROKE,Acute infarct in the left Posterior cerebral artery territory
LEFTPCASYNDROME,Typical deficits of left Posterior cerebral artery involvement
LEFTPCAOCCLUSION,Thrombotic or embolic blockage of the left Posterior cerebral artery
LEFTBASILARSTROKE,Acute infarct in the left Basilar artery territory
LEFTBASILARSYNDROME,Typical deficits of left Basilar artery involvement
LEFTBASILAROCCLUSION,Thrombotic or embolic blockage of the left Basilar artery
LEFTCAROTIDSTROKE,Acute infarct in the left Internal carotid artery territory
LEFTCAROTIDSYNDROME,Typical deficits of left Internal carotid artery involvement
LEFTCAROTIDOCCLUSION,Thrombotic or embolic blockage of the left Internal carotid artery
LEFTVERTEBRALSTROKE,Acute infarct in the left Vertebral artery territory
