APHASIA,Language impairment after domina...
DYSMETRIA,Past pointing on finger-to-nose...
HEMIBALLISMUS,Violent flinging limb movements...
HEMIPARESIS,Weakness of one side of the body
ASTEREOGNOSIS,Inability to identify objects by...
AGRAPHIA,Loss of the ability to write
ALEXIA,Acquired inability to read
ANOSOGNOSIA,Unawareness of one's own neurolo...
ATAXIA,Uncoordinated gait / limb movements
DYSARTHRIA,Motor speech disorder w/ slurred...
DYSTONIA,Sustained / intermittent muscle...
MYOCLONUS,"Sudden, brief, shock-like muscle..."
TREMOR,Rhythmic oscillatory movement at...
NYSTAGMUS,Repetitive involuntary eye movem...
VERTIGO,Illusory sense of motion from ve...
MIGRAINE,Recurrent headache often w/ phot...
EPILEPSY,Tendency for recurrent unprovoke...
AURA,Transient focal symptoms precedi...
GERSTMANN,"Agraphia, acalculia, finger agno..."
BABINSKI,Upgoing plantar response indicat...
APHONIA,Loss of voice due to laryngeal /...
APRAXIA,Inability to perform learned mot...
AGNOSIA,Failure to recognize objects des...
PROSOPAGNOSIA,Inability to recognize familiar...
HEMINEGLECT,Failure to attend to one side of...
HEMIANOPIA,Loss of half of the visual field
QUADRANTANOPIA,Loss of a quarter of the visual...
SCOTOMA,Focal area of visual field loss
DIPLOPIA,Double vision
PTOSIS,Drooping of the upper eyelid
MIOSIS,Pupillary constriction
MYDRIASIS,Pupillary dilation
ANISOCORIA,Unequal pupil sizes
HORNERSYNDROME,"Ptosis, miosis, anhidrosis from..."
INTERNUCLEAROPHTHALMOPLEGIA,Impaired adduction w/ abducting...
ONEANDAHALFSYNDROME,Ipsilateral gaze palsy w/ contra...
PARINAUDSYNDROME,Dorsal midbrain synd. w/ upgaze...
MILLERFISHER,"Ataxia, areflexia, ophthalmopleg..."
WALLENBERG,Lateral medullary infarct synd.
WEBERSYNDROME,Midbrain stroke w/ ipsilateral C...
BENEDIKT,Midbrain tegmentum synd. w/ ocul...
BROWNSEQUARD,Hemisection of spinal cord causi...
ANTERIORCORDSYNDROME,Loss of motor & pain/temperature...
CENTRALCORDSYNDROME,Upper limb weakness greater than...
POSTERIORCORDSYNDROME,Loss of vibration & propriocepti...
CAUDAEQUINA,"Radicular pain, asymmetric weakn..."
CONUSMEDULLARIS,"Symmetric weakness, early sphinc..."
CORTICOSPINALTRACT,Descending motor pathway from co...
SPINOTHALAMICTRACT,Ascending pain & temperature pat...
DORSALCOLUMNS,Ascending vibration & propriocep...
SUBTHALAMICNUCLEUS,Lesion here causes hemiballismus
BASALGANGLIA,Deep nuclei modulating movement...
GLOBUSPALLIDUSINTERNUS,Target of deep brain stimulation...
SUBSTANTIANIGRA,Dopaminergic midbrain nucleus de...
REDNUCLEUS,Midbrain structure associated w/...
LOCUSCOERULEUS,Pontine norepinephrine nucleus l...
CEREBELLARPEDUNCLES,Fiber bundles connecting cerebel...
VERMIS,Midline cerebellar structure; le...
FLOCCULUS,Cerebellar region for vestibulo-...
PURKINJECELL,Principal inhibitory neuron of c...
OLFACTORYNERVE,Cranial nerve I for smell
OPTICNERVE,Cranial nerve II for vision
OCULOMOTORNERVE,Cranial nerve III for eye moveme...
TROCHLEARNERVE,Cranial nerve IV innervating sup...
TRIGEMINALNERVE,Cranial nerve V for facial sensa...
ABDUCENSNERVE,Cranial nerve VI innervating lat...
FACIALNERVE,Cranial nerve VII for facial exp...
VESTIBULOCOCHLEARNERVE,Cranial nerve VIII for hearing &...
GLOSSOPHARYNGEALNERVE,Cranial nerve IX for taste post....
VAGUSNERVE,Cranial nerve X for parasympathe...
ACCESSORYNERVE,Cranial nerve XI for sternocleid...
HYPOGLOSSALNERVE,Cranial nerve XII for tongue mov...
PARKINSONDISEASE,"Bradykinesia, rigidity, rest tre..."
MULTIPLESYSTEMATROPHY,Atypical parkinsonism w/ early a...
PROGRESSIVESUPRANUCLEARPALSY,Vertical gaze palsy w/ early fal...
CORTICOBASALSYNDROME,Asymmetric apraxia & cortical se...
ESSENTIALTREMOR,Action tremor improved by alcoho...
HUNTINGTONDISEASE,Autosomal dominant chorea w/ CAG...
WILSONDISEASE,Copper metabolism disorder w/ mo...
DOPARESPONSIVEDYSTONIA,Childhood-onset dystonia improve...
TOURETTESYNDROME,Motor & vocal tics before age 18
AKATHISIA,Subjective inner restlessness w/...
BRADYKINESIA,Slowness of movement; cardinal f...
RIGIDITY,Velocity-independent resistance...
CHOREA,"Random, flowing, dance-like move..."
BALLISM,"Flinging, proximal movements; se..."
TIC,"Sudden, stereotyped, suppressibl..."
SPASTICITY,Velocity-dependent increase in m...
FLACCIDPARALYSIS,Hypotonia & areflexia from lower...
FASCICULATION,Visible spontaneous muscle fiber...
MYOTONIA,Delayed relaxation after contrac...
NEUROMYOTONIA,Continuous muscle fiber activity...
MYASTHENIAGRAVIS,Fluctuating fatigable weakness;...
LAMBERTEATON,Proximal weakness improves w/ ex...
GUILLAINBARRE,Acute inflammatory demyel. polyr...
CIDP,Chronic inflammatory demyel. pol...
MMN,Multifocal motor neurop. w/ cond...
ALS,Combined upper & lower motor neu...
SMA,Genetic ant. horn cell dz; SMN1...
CARPALTUNNEL,Median neurop. at the wrist caus...
ULNARNEUROPATHY,Entrapment at elbow causing numb...
RADIALNEUROPATHY,Wrist drop after compression in...
PERONEALNEUROPATHY,Foot drop from fibular head entr...
TARSALTUNNEL,post. tibial nerve entrapment at...
MERALGIAPARESTHETICA,Lateral femoral cutaneous nerve...
SMALLFIBERNEUROPATHY,Burning pain w/ preserved streng...
DEMYELINATINGNEUROPATHY,Slowed conduction w/ prolonged d...
AXONALNEUROPATHY,Low amplitudes w/ relatively pre...
TRIGEMINALNEURALGIA,Lancinating facial pain triggere...
GLOSSOPHARYNGEALNEURALGIA,Throat/ear pain triggered by swa...
HEMIFACIALSPASM,Involuntary unilateral facial co...
BELLPALSY,Acute LMN facial palsy; idiopathic
CLUSTERHEADACHE,Severe orbital pain w/ autonomic...
PAROXYSMALHEMICRANIA,"Short unilateral headaches, indo..."
SUNCT,Short-lasting unilateral neuralg...
SUNA,Short-lasting unilateral neuralg...
HEMICRANIACONTINUA,"Continuous unilateral headache,..."
STATUSMIGRAINOSUS,Migraine lasting >72 hours
MEDICATIONOVERUSEHEADACHE,Chronic daily headache due to fr...
CEREBRALVENOUSTHROMBOSIS,Headache w/ papilledema; MRV sho...
SUBARACHNOIDHEMORRHAGE,Thunderclap headache from ruptur...
INTRACEREBRALHEMORRHAGE,Lobar / deep bleed; hypertension...
EPIDURALHEMATOMA,Lens-shaped collection after tem...
SUBDURALHEMATOMA,Crescent-shaped collection; brid...
CEREBRALAMYLOIDANGIOPATHY,Lobar bleed in elderly w/ microb...
ARTERIOVENOUSMALFORMATION,Congenital shunt causing bleed /...
CAVERNOUSMALFORMATION,Mulberry lesion w/ hemosiderin r...
ISCHEMICSTROKE,Focal deficit from arterial occl.
LACUNARINFARCT,Small deep infarct from lipohyal...
WATERSHEDINFARCT,Borderzone ischemia between arte...
HYPERDENSEMCASIGN,Noncontrast CT clue of acute thr...
DENSEBASILARSIGN,Hyperattenuated basilar a. on CT...
DOTSIGN,Thrombosed M2 branch seen as hyp...
ASPECTS,Ten-point CT score for early isc...
NIHSS,Standardized scale to quantify s...
MRS,mRS for disability after stroke
TPA,Alteplase thrombolysis for acute...
TENECTEPLASE,Fibrin-specific thrombolytic use...
THROMBECTOMY,Endovascular clot retrieval for...
PERFUSIONMISMATCH,CT/MR penumbra-core imbalance gu...
OSMOTICDEMYELINATION,Central pontine/extrapontine mye...
WERNICKEENCEPHALOPATHY,Thiamine deficiency w/ confusion...
KORSAKOFF,Amnestic synd. w/ confabulation...
MARCHIAFAVABIGNAMI,Corpus callosum demyelination in...
HEPATICENCEPHALOPATHY,Cognitive slowing from hyperammo...
HYPOXICISCHEMICINJURY,Global anoxic brain injury after...
POSTERIORREVERSIBLEENCEPHALOPATHY,"Headache, seizures, visual loss..."
REVERSIBLECEREBRALVASOCONSTRICTION,Recurrent thunderclap headaches...
MELAS,Mitochondrial encephalomyopathy...
MERRF,Myoclonic epilepsy w/ ragged red...
LHON,Leber hereditary optic neurop. c...
CANVAS,"Cerebellar ataxia, neurop., vest..."
FRAGILEXTREMORATAXIA,Late-onset tremor/ataxia from FM...
FAHRDISEASE,Basal ganglia calcifications w/...
NEUROACANTHOCYTOSIS,Chorea w/ acanthocytes on smear
CREUTZFELDTJAKOB,Rapidly progressive dementia w/...
ALZHEIMERDISEASE,Gradual amnestic dementia w/ med...
LEWYBODYDEMENTIA,"Fluctuations, visual hallucinati..."
FRONTOTEMPORALDEMENTIA,Early behavioral change / langua...
PRIMARYPROGRESSIVEAPHASIA,Gradual loss of language; nonflu...
NORMALPRESSUREHYDROCEPHALUS,"Gait, cognition, urinary inconti..."
HYDROCEPHALUS,Enlarged ventricles from CSF imb...
IDIOPATHICINTRACRANIALHYPERTENSION,Headache w/ papilledema in obese...
PAPILLEDEMA,Optic disc swelling from raised...
OPTICNEURITIS,Painful subacute monocular visua...
UHTOFF,Worsening of neurologic symptoms...
LHERMITTESIGN,Electric shock sensation w/ neck...
MULTIPLESCLEROSIS,Immune-mediated demyel. dz w/ di...
NEUROMYELITISOPTICA,AQP4-IgG astrocytopathy w/ longi...
MOGANTIBODYDISEASE,Inflammatory demyelination targe...
TRANSVERSEMYELITIS,Subacute spinal cord inflammatio...
ACUTEDISSEMINATEDENCEPHALOMYELITIS,Postinfectious demyelination in...
ADEM,Abbreviation for acute dissemina...
BICKERSTAFFENCEPHALITIS,Brainstem enceph. w/ ataxia & op...
ANTINMDARECEPTOR,Autoimmune enceph. w/ psychiatri...
LGI1ENCEPHALITIS,Faciobrachial dystonic seizures...
CASPR2ENCEPHALITIS,Autoimmune limbic enceph. w/ per...
GAD65ENCEPHALITIS,Autoimmune epilepsy; may cause l...
STIFFPERSONSYNDROME,GAD antibodies w/ axial rigidity...
OPSOCLONUSMYOCLONUS,Chaotic saccades w/ myoclonus &...
INFANTILESPASMS,West synd. w/ hypsarrhythmia on EEG
WESTSYNDROME,"Infantile spasms, hypsarrhythmia..."
LENNOXGASTAUT,Childhood epileptic enceph. w/ m...
DRAVET,Severe myoclonic epilepsy of inf...
OHTAHARA,Early infantile epileptic enceph.
LANDAUKLEFFNER,Acquired epileptic aphasia of ch...
BENIGNROLANDICEPILEPSY,Centrotemporal spikes w/ nocturn...
JUVENILEMYOCLONICEPILEPSY,Myoclonic jerks after awakening;...
ABSENCEEPILEPSY,Brief staring spells w/ 3 Hz spi...
TEMPORALLOBEEPILEPSY,Focal impaired awareness seizure...
STATUSEPILEPTICUS,Seizure lasting >5 minutes / rec...
EEG,EEG; records cortical electrical...
MEG,MEG; measures magnetic fields fr...
PET,Positron emission tomography for...
SPECT,Perfusion img used in ictal epil...
DATSCAN,Nigrostriatal dopamine transport...
LUMBARPUNCTURE,Needle CSF access at L3-4 / L4-5...
OPENINGPRESSURE,First CSF pressure measured at l...
XANTHOCHROMIA,Yellow CSF supernatant after bleed
OLIGOCLONALBANDS,CSF-restricted IgG bands suggest...
ALBUMINOCYTOLOGICDISSOCIATION,High CSF protein w/ normal cell...
FRONTALLOBE,"Executive function, motor planni..."
PARIETALLOBE,Somatosensory integration; postc...
TEMPORALLOBE,Audition & memory; hippocampus &...
OCCIPITALLOBE,Primary visual cortex region
INSULA,Hidden cortical region for inter...
HIPPOCAMPUS,Medial temporal memory structure...
AMYGDALA,Limbic nucleus for emotion & fea...
THALAMUS,Relay hub for sensory & motor in...
HYPOTHALAMUS,Autonomic & endocrine master reg...
BASALFOREBRAIN,Cholinergic nuclei important for...
PINEALGLAND,Melatonin-secreting structure ca...
PITUITARYGLAND,Endocrine master gland; macroade...
MIDBRAIN,Mesencephalon; location of red n...
PONS,Bridge containing cranial nerve...
MEDULLA,Contains vital centers for breat...
CEREBELLUM,Coordinates movement & balance
DENTATENUCLEUS,Largest deep cerebellar nucleus;...
FORAMENMAGNUM,Opening through which medulla tr...
CORPUSCALLOSUM,Major commissural fiber tract co...
INTERNALCAPSULE,post. limb carries corticospinal...
CORONARADIATA,Fan-like white matter above inte...
FORNIX,Efferent pathway from hippocampu...
MAMILLARYBODIES,Memory relay structures damaged...
CALCARINECORTEX,Primary visual cortex along calc...
BROCAAREA,Inferior frontal gyrus region fo...
WERNICKEAREA,post. superior temporal gyrus fo...
ANGULARGYRUS,Parietal region implicated in Ge...
SUPRAMARGINALGYRUS,Parietal lobe region for phonolo...
PRECENTRALGYRUS,Primary motor cortex
POSTCENTRALGYRUS,Primary somatosensory cortex
ARCUATEFASCICULUS,White matter tract linking Broca...
MEYERLOOP,Temporal optic radiations causin...
BAUMLOOP,Parietal optic radiations causin...
SUBARACHNOIDSPACE,CSF-filled compartment between a...
CHOROIDPLEXUS,CSF-producing epithelium within...
AQUEDUCTOFSYLVIUS,cereb. aqueduct connecting third...
FOURTHVENTRICLE,Ventricular cavity dorsal to pon...
LATERALVENTRICLE,C-shaped ventricular compartment...
BASALGANGLIACIRCUITS,Direct & indirect pathways modul...
NUCLEUSACCUMBENS,Ventral striatum involved in reward
PUTAMEN,Lateral basal ganglia nucleus; m...
CAUDATENUCLEUS,Head atrophy causes boxcar ventr...
GLOBUSPALLIDUSEXTERNUS,Part of indirect pathway for mov...
FLAIR,MRI sequence suppressing CSF to...
DWI,MRI sequence sensitive to restri...
ADC,Map inverse to DWI; low values i...
SWI,MRI sequence highlighting suscep...
GRE,Gradient echo sequence; sensitiv...
MRA,Noninvasive MR angiography of ve...
CTA,CT angiography visualizing arter...
CTPERFUSION,Dynamic img to estimate core & p...
VESSELWALLMRI,High-resolution img of intracran...
CAROTIDULTRASOUND,Duplex study for stenosis & plaque
TRANSCRANIALDOPPLER,Ultrasound assessing intracrania...
EEGMONTAGE,Arrangement of electrodes for sc...
MEP,Motor evoked potential assessing...
SSEP,Somatosensory evoked potential f...
SUMATRIPTAN,Serotonin 5-HT1B/1D agonist for...
RIZATRIPTAN,Fast-acting triptan for acute mi...
ZOLMITRIPTAN,Triptan available as nasal spray...
NARATRIPTAN,Longer-acting triptan used for m...
FROVATRIPTAN,Long half-life triptan helpful f...
LASMIDITAN,Selective 5-HT1F agonist for acu...
UBROGEPANT,Oral CGRP receptor antagonist fo...
RIMEGEPANT,Gepant used acutely & preventive...
ATOGEPANT,Oral CGRP antagonist for prevent...
ERENUMAB,Monoclonal antibody targeting CG...
FREMANEZUMAB,Anti-CGRP monoclonal antibody fo...
GALCANEZUMAB,Anti-CGRP monoclonal antibody fo...
EPTINEZUMAB,IV anti-CGRP monoclonal antibody...
DIHYDROERGOTAMINE,Ergot derivative for status migr...
PROPRANOLOL,Beta blocker used for migraine p...
TOPIRAMATE,Antiepileptic effective for migr...
VALPROATE,Antiepileptic used for migraine...
AMITRIPTYLINE,Tricyclic antidepressant for mig...
ONABOTULINUMTOXINA,Botox injections for chronic mig...
LEVETIRACETAM,Broad-spectrum antiseizure drug;...
BRIVARACETAM,SV2A ligand similar to levetirac...
LACOSAMIDE,Enhances slow inactivation of so...
LAMOTRIGINE,Sodium channel blocker; risk of...
CARBAMAZEPINE,Sodium channel blocker; induces...
OXCARBAZEPINE,Related to carbamazepine w/ less...
ESLICARBAZEPINE,Once-daily sodium channel blocker
ZONISAMIDE,Sulfonamide w/ carbonic anhydras...
PERAMPANEL,AMPA receptor antagonist; behavi...
PHENOBARBITAL,Barbiturate used in neonatal sei...
PHENYTOIN,Zero-order kinetics; nystagmus &...
FOSPHENYTOIN,Prodrug of phenytoin for IV loading
CLOBAZAM,Benzodiazepine used in Lennox-Ga...
CLONAZEPAM,Benzodiazepine for myoclonus & a...
DIAZEPAM,Rescue benzodiazepine for seizures
MIDAZOLAM,Intranasal / IM benzodiazepine f...
GABAPENTIN,Alpha-2-delta ligand for focal s...
PREGABALIN,Alpha-2-delta ligand for neuropa...
TIAGABINE,GABA reuptake inhibitor; risk of...
VIGABATRIN,Irreversible GABA transaminase i...
FELBAMATE,NMDA antagonist w/ aplastic anem...
RUFINAMIDE,Prolongs sodium channel inactiva...
CANNABIDIOL,Approved for Dravet & Lennox-Gas...
STIRIPENTOL,Adjunct for Dravet synd. w/ clob...
FENFLURAMINE,Serotonergic agent for Dravet synd.
CARBIDOPALEVODOPA,Dopamine precursor w/ periph. de...
PRAMIPEXOLE,Dopamine agonist; impulse contro...
ROPINIROLE,Dopamine agonist for Parkinson dz
ROTIGOTINE,Transdermal dopamine agonist patch
AMANTADINE,NMDA antagonist helpful for dysk...
SELEGILINE,MAO-B inhibitor; adjunct in earl...
RASAGILINE,MAO-B inhibitor for symptomatic...
SAFINAMIDE,Reversible MAO-B inhibitor w/ gl...
ENTACAPONE,COMT inhibitor extending levodop...
TOLCAPONE,COMT inhibitor; hepatotoxicity risk
OPICAPONE,Once-daily COMT inhibitor
INHALEDLEVODOPA,Rescue therapy for OFF episodes
DEEPBRAINSTIMULATION,Surgical therapy targeting STN /...
INTERFERONBETA,Injectable therapy for relapsing MS
GLATIRAMERACETATE,Co-polymer injection for relapsi...
DIMETHYLFUMARATE,Oral fumarate; lymphopenia risk
DIROXIMELFUMARATE,Newer fumarate w/ GI tolerability
TERIFLUNOMIDE,Oral pyrimidine synthesis inhibi...
FINGOLIMOD,S1P modulator; first-dose bradyc...
SIPONIMOD,S1P modulator approved for SPMS
OZANIMOD,S1P modulator w/ less bradycardia
NATALIZUMAB,Anti-alpha4 integrin; PML risk s...
OCRELIZUMAB,Anti-CD20 monoclonal antibody; P...
OFATUMUMAB,Self-injected anti-CD20 for RRMS
RITUXIMAB,Off-label anti-CD20 used in MS/N...
CLADRIBINE,Oral purine analog immune recons...
ALEMTUZUMAB,Anti-CD52 monoclonal; autoimmune...
ECULIZUMAB,Complement inhibitor approved fo...
INEBILIZUMAB,Anti-CD19 monoclonal for NMOSD
SATRALIZUMAB,IL-6 receptor blocker for NMOSD
IVIG,Intravenous immunoglobulin used...
PLASMAPHERESIS,Apheresis removing pathogenic an...
GLIOBLASTOMA,IDH-wildtype WHO grade 4 astrocy...
ASTROCYTOMA,Glial neoplasm from astrocytes;...
OLIGODENDROGLIOMA,"IDH mutant, 1p/19q codeleted dif..."
EPENDYMOMA,Tumor of ependymal cells lining...
MEDULLOBLASTOMA,Embryonal post. fossa tumor in c...
MENINGIOMA,Extra-axial dural-based tumor; o...
SCHWANNOMA,periph. nerve sheath tumor; Anto...
VESTIBULARSCHWANNOMA,CP angle tumor causing unilatera...
NEUROFIBROMA,periph. nerve tumor; plexiform t...
HEMANGIOBLASTOMA,Highly vascular cerebellar tumor...
CRANIOPHARYNGIOMA,Suprasellar cystic tumor; bitemp...
PINEOBLASTOMA,Malignant pineal region tumor
CHORDOMA,Midline notochordal tumor at cli...
PITUITARYADENOMA,Hormone secreting / nonfunctioni...
MENINGEALCARCINOMATOSIS,Leptomeningeal spread of systemi...
PRIMARYCNSLYMPHOMA,Enhancing periventricular lesion...
HERPESENCEPHALITIS,Temporal lobe enceph. from HSV-1
VARICELLAZOSTERVASCULOPATHY,Stroke after shingles due to ves...
PROGRESSIVEMULTIFOCALLEUKOENCEPHALOPATHY,JC virus demyelination in immuno...
NEUROCYSTICERCOSIS,Parasitic brain infection w/ rin...
TOXOPLASMOSIS,Multiple ring-enhancing lesions...
CRYPTOCOCCALMENINGITIS,CSF w/ high opening pressure & p...
TUBERCULOUSMENINGITIS,Basilar meningeal enhancement w/...
LISTERIAMENINGITIS,Gram-positive rod; consider in e...
LYMENEUROBORRELIOSIS,Facial palsy / meningitis after...
NEUROSYPHILIS,Tabes dorsalis / general paresis...
WESTNILEENCEPHALITIS,Flaccid paralysis w/ ant. horn c...
ENTEROVIRALMENINGITIS,Self-limited aseptic meningitis...
AUTOIMMUNEENCEPHALITIS,Antibody-mediated limbic dysfunc...
NARCOLEPSY,Excessive daytime sleepiness w/...
CATAPLEXY,Emotion-triggered loss of muscle...
REMBEHAVIORDISORDER,Dream enactment due to loss of a...
SLEEPAPNEA,Repetitive upper airway obstruct...
RESTLESSLEGS,Urge to move legs worse at rest...
ORTHOSTATICHYPOTENSION,Drop in blood pressure on standi...
POTS,Excessive heart rate increase on...
MULTIPLESYSTEMATROPHYCEREBELLAR,MSA-C variant w/ gait ataxia
MULTIPLESYSTEMATROPHYPARKINSONIAN,MSA-P variant w/ bradykinesia &...
GLASGOWCOMASCALE,"Eye, verbal, motor score for con..."
FOURSCORE,Alternative coma scale including...
HUNTANDHESS,Subarachnoid bleed clinical grad...
FISHERSCALE,CT blood grading for SAH vasospa...
ABCD2,TIA risk stratification score
CHA2DS2VASC,Atrial fibrillation stroke risk...
HASBLED,Bleeding risk score in anticoagu...
ROMBERG,Sway w/ eyes closed indicates pr...
HOFFMANNSIGN,Finger flexion w/ flicking nail...
KERNIGSIGN,Hamstring pain/resistance w/ kne...
BRUDZINSKISIGN,Hip/knee flexion w/ neck flexion...
HINTSEXAM,"Head impulse, nystagmus, test of..."
EPLEYMANEUVER,Canalith repositioning for post....
DIXHALLPIKE,Provocative test for post. canal...
LEFTMCASTROKE,Acute infarct in the left mid. c...
LEFTMCASYNDROME,Typical deficits of left mid. ce...
LEFTMCAOCCLUSION,Thrombotic / embolic blockage of...
LEFTACASTROKE,Acute infarct in the left ant. c...
LEFTACASYNDROME,Typical deficits of left ant. ce...
LEFTACAOCCLUSION,Thrombotic / embolic blockage of...
LEFTPCASTROKE,Acute infarct in the left post....
LEFTPCASYNDROME,Typical deficits of left post. c...
LEFTPCAOCCLUSION,Thrombotic / embolic blockage of...
LEFTBASILARSTROKE,Acute infarct in the left Basila...
LEFTBASILARSYNDROME,Typical deficits of left Basilar...
LEFTBASILAROCCLUSION,Thrombotic / embolic blockage of...
LEFTCAROTIDSTROKE,Acute infarct in the left Intern...
LEFTCAROTIDSYNDROME,Typical deficits of left Interna...
LEFTCAROTIDOCCLUSION,Thrombotic / embolic blockage of...
LEFTVERTEBRALSTROKE,Acute infarct in the left Verteb...
LEFTVERTEBRALSYNDROME,Typical deficits of left Vertebr...
LEFTVERTEBRALOCCLUSION,Thrombotic / embolic blockage of...
RIGHTMCASTROKE,Acute infarct in the right mid....
RIGHTMCASYNDROME,Typical deficits of right mid. c...
RIGHTMCAOCCLUSION,Thrombotic / embolic blockage of...
RIGHTACASTROKE,Acute infarct in the right ant....
RIGHTACASYNDROME,Typical deficits of right ant. c...
RIGHTACAOCCLUSION,Thrombotic / embolic blockage of...
RIGHTPCASTROKE,Acute infarct in the right post....
RIGHTPCASYNDROME,Typical deficits of right post....
RIGHTPCAOCCLUSION,Thrombotic / embolic blockage of...
RIGHTBASILARSTROKE,Acute infarct in the right Basil...
RIGHTBASILARSYNDROME,Typical deficits of right Basila...
RIGHTBASILAROCCLUSION,Thrombotic / embolic blockage of...
RIGHTCAROTIDSTROKE,Acute infarct in the right Inter...
RIGHTCAROTIDSYNDROME,Typical deficits of right Intern...
RIGHTCAROTIDOCCLUSION,Thrombotic / embolic blockage of...
RIGHTVERTEBRALSTROKE,Acute infarct in the right Verte...
RIGHTVERTEBRALSYNDROME,Typical deficits of right Verteb...
RIGHTVERTEBRALOCCLUSION,Thrombotic / embolic blockage of...
THORACICOUTLETSYNDROME,Compression of brachial plexus /...
LONGTHORACICNEUROPATHY,Scapular winging from serratus a...
SUPRASCAPULARNEUROPATHY,Shoulder pain w/ infraspinatus w...
AXILLARYNEUROPATHY,Deltoid weakness after shoulder...
FEMORALNEUROPATHY,Quadriceps weakness w/ reduced k...
OBTURATORNEUROPATHY,Adductor weakness & medial thigh...
SCIATICNEUROPATHY,Weakness below knee w/ sensory l...
TIBIALNEUROPATHY,Plantar flexion weakness; tarsal...
SURALNEUROPATHY,Lateral foot numbness after ankl...
LATERALANTEBRACHIALCUTANEOUSNEUROPATHY,Forearm numbness after biceps te...
BRACHIALNEURITIS,Severe shoulder pain followed by...
LUMBOSACRALPLEXOPATHY,"Pelvic tumor, diabetes, / radiat..."
DIABETICAMYOTROPHY,Painful proximal leg weakness fr...
NERVECONDUCTIONSTUDY,Assesses large myelinated fibers...
ELECTROMYOGRAPHY,Needle exam of muscle to assess...
SINGLEFIBEREMG,Highly sensitive test for neurom...
EVOKEDPOTENTIALS,Electrical responses to sensory...
AUTONOMICTESTING,"QSART, tilt table, Valsalva for..."
C9ORF72,Repeat expansion causing ALS/FTD...
SOD1,Superoxide dismutase gene mutate...
HTT,Huntingtin gene w/ CAG expansion
PMP22,Gene duplicated in CMT1A
GAA,Trinucleotide repeat causing Fri...
NOTCH3,Gene mutated in CADASIL small ve...
GFAP,Astrocytic intermediate filament...
ARSA,Deficiency in metachromatic leuk...
GALC,Deficiency in Krabbe dz
ABCD1,Adrenoleukodystrophy peroxisomal...
POLG,Mitochondrial polymerase mutatio...
TTR,Transthyretin gene in amyloid ne...
CERVICALSPONDYLOTICMYELOPATHY,Gait imbalance & hand clumsiness...
RADICULOPATHY,Dermatomal pain & weakness from...
MYELOPATHY,Spinal cord dysfunction causing...
SYRINGOMYELIA,Cavitation of spinal cord w/ cap...
TETHEREDCORD,Low conus w/ filum thickening; p...
EPIDURALABSCESS,"Fever, back pain, neurologic def..."
SPINALEPIDURALHEMATOMA,Acute cord compression after pro...
SPINALAVFISTULA,Foix-Alajouanine myelopathy w/ v...
UHTHOFFPHENOMENON,Worsening of MS symptoms w/ heat...
HERTWIGMAGENDIE,Downbeat nystagmus w/ foramen ma...
SKEWDEVIATION,Vertical ocular misalignment fro...
OCULARTILTREACTION,Head tilt w/ ocular torsion from...
GOWERSIGN,Proximal weakness sign when risi...
BABINSKISIGN,Extensor plantar response indica...
CHADDOCKSIGN,Alternative plantar reflex elici...
LEFTHEMIANOPIA,Visual field loss on the left ha...
LEFTHEMIPARESIS,Weakness of the left side of the...
LEFTNEGLECT,Inattention to the left side of...
LEFTFACIALPALSY,Lower motor neuron facial weakne...
LEFTPRONATORDRIFT,Arm pronates & drifts on the lef...
LEFTATAXIA,Limb incoordination more on the...
RIGHTHEMIANOPIA,Visual field loss on the right h...
RIGHTHEMIPARESIS,Weakness of the right side of th...
RIGHTNEGLECT,Inattention to the right side of...
RIGHTFACIALPALSY,Lower motor neuron facial weakne...
RIGHTPRONATORDRIFT,Arm pronates & drifts on the rig...
RIGHTATAXIA,Limb incoordination more on the...
CRANIALNERVE3PALSY,"Deficit w/ ptosis, 'down & out'..."
CRANIALNERVE4PALSY,Deficit w/ vertical diplopia wor...
CRANIALNERVE6PALSY,Deficit w/ horizontal diplopia f...
CRANIALNERVE7PALSY,Deficit w/ facial weakness & los...
CRANIALNERVE9PALSY,Deficit w/ loss of gag & post. t...
CRANIALNERVE10PALSY,Deficit w/ dysphonia & impaired...
CRANIALNERVE12PALSY,Deficit w/ tongue deviation towa...
DOWNBEATNYSTAGMUS,Fast phase downward; cervicomedu...
UPBEATNYSTAGMUS,Fast phase upward; medullary loc...
GAZEEVOKEDNYSTAGMUS,Increasing on eccentric gaze; ce...
OPSOCLONUS,Chaotic multidirectional saccade...
BACLOFEN,GABA-B agonist used for spasticity
TIZANIDINE,Alpha-2 agonist for spasticity
DANTROLENE,Ryanodine receptor blocker reduc...
TRIHEXYPHENIDYL,Anticholinergic for tremor in yo...
BENZTROPINE,Anticholinergic for parkinsonian...
PIMAVANSERIN,5-HT2A inverse agonist for PD ps...
RIVASTIGMINE,Cholinesterase inhibitor used in...
DONEPEZIL,Cholinesterase inhibitor for Alz...
GALANTAMINE,Cholinesterase inhibitor for Alz...
MEMANTINE,NMDA antagonist for moderate to...
BROCAAPHASIA,"Nonfluent, effortful speech w/ r..."
WERNICKEAPHASIA,Fluent but meaningless speech w/...
CONDUCTIONAPHASIA,Impaired repetition w/ relativel...
GLOBALAPHASIA,Severe impairment in expression...
TRANSCORTICALMOTORAPHASIA,Nonfluent speech w/ preserved re...
TRANSCORTICALSENSORYAPHASIA,Fluent speech w/ preserved repet...
ANOMICAPHASIA,Word-finding difficulty w/ other...
LEFTHOMONYMOUSHEMIANOPIA,Loss of left visual field in bot...
LEFTSUPERIORQUADRANTANOPIA,'Left pie in the sky' visual fie...
LEFTINFERIORQUADRANTANOPIA,'Left pie on the floor' visual f...
RIGHTHOMONYMOUSHEMIANOPIA,Loss of right visual field in bo...
RIGHTSUPERIORQUADRANTANOPIA,'Right pie in the sky' visual fi...
RIGHTINFERIORQUADRANTANOPIA,'Right pie on the floor' visual...
BITEMPORALHEMIANOPIA,Loss of temporal fields from chi...
BINASALHEMIANOPIA,"Loss of nasal fields; rare, ofte..."
ARTERYOFPERCHERONINFARCT,Bilateral paramedian thalamic in...
