RECURRENTARTERYOFHEUBNER,Supplies caudate head & ant. int...
LENTICULOSTRIATEINFARCT,Deep perforator stroke affecting...
ANTERIORCHOROIDALINFARCT,"Hemiparesis, hemisensory loss, h..."
LEFTPICASTROKE,Infarct of the PICA territory on...
LEFTPICAINFARCT,Cerebellar/brainstem ischemia in...
LEFTPICASYNDROME,Characteristic deficits from PIC...
LEFTAICASTROKE,Infarct of the AICA territory on...
LEFTAICAINFARCT,Cerebellar/brainstem ischemia in...
LEFTAICASYNDROME,Characteristic deficits from AIC...
LEFTSCASTROKE,Infarct of the SCA territory on...
LEFTSCAINFARCT,Cerebellar/brainstem ischemia in...
LEFTSCASYNDROME,Characteristic deficits from SCA...
RIGHTPICASTROKE,Infarct of the PICA territory on...
RIGHTPICAINFARCT,Cerebellar/brainstem ischemia in...
RIGHTPICASYNDROME,Characteristic deficits from PIC...
RIGHTAICASTROKE,Infarct of the AICA territory on...
RIGHTAICAINFARCT,Cerebellar/brainstem ischemia in...
RIGHTAICASYNDROME,Characteristic deficits from AIC...
RIGHTSCASTROKE,Infarct of the SCA territory on...
RIGHTSCAINFARCT,Cerebellar/brainstem ischemia in...
RIGHTSCASYNDROME,Characteristic deficits from SCA...
FOVILLESYNDROME,Medial pontine lesion w/ gaze pa...
RAYMONDSYNDROME,Medial pontine infarct w/ abduce...
CLAUDESYNDROME,Midbrain tegmentum lesion w/ ocu...
DEJERINESYNDROME,Medial medullary infarct w/ cont...
LOCKEDINSYNDROME,Quadriplegia w/ preserved vertic...
LOSSOFINSULARRIBBON,Early ischemic change on noncont...
SULCALEFFACEMENT,Loss of cortical sulci from edem...
FOGGINGPHENOMENON,Subacute infarct appears isodens...
LUXURYPERFUSION,Hyperemia of infarcted tissue on...
EMPTYDELTASIGN,Filling defect in superior sagit...
HOTCROSSBUNSIGN,Pontine cruciform T2 hyperintens...
HUMMINGBIRDSIGN,Midbrain atrophy pattern in prog...
FACEOFTHEGIANTPANDA,Midbrain T2 pattern in Wilson dz
PULVINARSIGN,Thalamic hyperintensity in varia...
HYPERPERFUSIONSYNDROME,Headache & seizures after caroti...
TRAILMAKINGTEST,Timed test of visual attention &...
CLOCKDRAWINGTEST,Bedside screen for visuospatial...
BOSTONNAMINGTEST,Confrontation naming assessment
DIGITSPAN,Short-term auditory-verbal memor...
STROOPTEST,Assesses selective attention & i...
WISCONSINCARDSORTINGTEST,Measures set shifting & problem...
SYMBOLDIGITMODALITIES,Processing speed test used in MS
ANTIHU,ANNA-1 antibody causing sensory...
ANTIYO,PCA-1 antibody associated w/ par...
ANTIRI,ANNA-2 antibody w/ opsoclonus-my...
ANTIMA2,Antibody associated w/ limbic &...
ANTICRMP5,Collapsin response mediator prot...
AMPHIPHYSINANTIBODY,Paraneoplastic stiff-person synd...
IGLON5DISEASE,Sleep disorder w/ brainstem tauo...
DPPXENCEPHALITIS,Antibody-mediated hyperexcitabil...
GABABENCEPHALITIS,Limbic enceph. w/ seizures; smal...
AMPARECEPTORENCEPHALITIS,Limbic enceph. w/ memory loss &...
GFAPASTROCYTOPATHY,Autoimmune meningoencephalomyeli...
KCOMPLEX,EEG waveform seen in stage N2 sleep
SLEEPSPINDLE,12-14 Hz bursts in stage N2 sleep
REMATONIA,Paralysis of skeletal muscles du...
HYPNAGOGICHALLUCINATIONS,Perceptual experiences at sleep...
HYPNOPOMPICHALLUCINATIONS,Perceptual experiences upon awak...
CPAPTHERAPY,Positive airway pressure treatme...
TINELSIGN,Tapping over a nerve elicits par...
PHALENTEST,Wrist flexion provokes median ne...
SPURLINGMANEUVER,Cervical extension/rotation repr...
STRAIGHTLEGRAISE,Supine test stretching L5/S1 ner...
CROSSEDSTRAIGHTLEGRAISE,Contralateral pain indicates lar...
FROMENTSIGN,Thumb IP flexion indicates ulnar...
WARTENBERGSIGN,Abducted little finger from ulna...
ADSONTEST,Thoracic outlet maneuver reducin...
JAWJERK,Masseter reflex; exaggerated in...
SNOUTREFLEX,Puckering w/ tapping philtrum; f...
PALMOMENTALREFLEX,Chin muscle twitch w/ stroking t...
GRASPREFLEX,Involuntary grasping w/ palmar s...
OPPENHEIMSIGN,Toe extension w/ tibial crest st...
GORDONSIGN,Great toe extension w/ calf sque...
JENDRASSIKMANEUVER,Reinforcement technique for deep...
HOLMESTREMOR,Low-frequency rest & action trem...
ORTHOSTATICTREMOR,Fast 13-18 Hz tremor causing uns...
DYSTONICTREMOR,Irregular position-dependent tre...
CAMPTOCORMIA,Marked forward flexion of trunk...
PISASYNDROME,Lateral trunk flexion in parkins...
FREEZINGOFGAIT,Brief inability to initiate forw...
ONOFFPHENOMENON,Fluctuations between mobility &...
PEAKDOSEDYSKINESIA,Involuntary movements at levodop...
DROOLINGINPD,Sialorrhea due to reduced sponta...
AUTOMATISMS,Semi-purposeful repetitive behav...
GELASTICSEIZURES,Laughing spells from hypothalami...
DACRYSTICSEIZURES,Crying spells as ictal manifesta...
ICTALPOUTING,Chapeau de gendarme sign in fron...
POSTICTALSTATE,Transient confusion / focal defi...
TODDPARALYSIS,Transient focal weakness after a...
MESIALTEMPORALSCLEROSIS,Hippocampal atrophy & gliosis in...
HYPOTHALAMICHAMARTOMA,Lesion associated w/ gelastic se...
FOCALCORTICALDYSPLASIA,Developmental cortical malformat...
PERIVENTRICULARNODULARHETEROTOPIA,Ectopic gray matter nodules alon...
LISSENCEPHALY,Smooth brain w/ absent / reduced...
PACHYGYRIA,"Broad, reduced number of gyri"
POLYMICROGYRIA,Excess small gyri w/ abnormal co...
SCHIZENCEPHALY,Gray matter-lined clefts in cere...
SEEG,Stereoelectroencephalography for...
WADATEST,Intracarotid amobarbital procedu...
RESPONSIVENEUROSTIMULATION,Closed-loop device delivering st...
LEWYBODY,Alpha-synuclein inclusion in neu...
NEUROFIBRILLARYTANGLE,Hyperphosphorylated tau aggregat...
AMYLOIDPLAQUE,Extracellular beta-amyloid depos...
PICKBODY,Tau-positive cytoplasmic inclusi...
BUNINABODIES,Eosinophilic inclusions in motor...
NEGRIBODY,Cytoplasmic inclusion in rabies...
ROSENTHALFIBERS,Eosinophilic astrocytic inclusio...
LAFORABODY,Polyglucosan inclusion in progre...
TDP43,Proteinopathy in ALS & FTLD
HOLOPROSENCEPHALY,Failure of forebrain cleavage w/...
DANDYWALKERMALFORMATION,post. fossa cyst w/ vermian hypo...
CHIARIIMALFORMATION,Cerebellar tonsillar ectopia bel...
CHIARIIIMALFORMATION,Hindbrain herniation associated...
AGENESISOFCORPUSCALLOSUM,Absent interhemispheric commissu...
SEPTOOPTICDYSPLASIA,Optic nerve hypoplasia w/ midlin...
SPINALSHOCK,Flaccid paralysis & areflexia af...
NEUROGENICSHOCK,Hypotension & bradycardia from a...
AUTONOMICDYSREFLEXIA,Paroxysmal hypertension w/ high-...
ANTERIORSPINALARTERY,Midline vessel supplying ant. tw...
POSTERIORSPINALARTERY,Paired vessels supplying dorsal...
ARTERYOFADAMKIEWICZ,Major radicular a. feeding thora...
EWALDLAWS,Describe eye & head movement res...
OTOLITHORGANS,Utricle & saccule detect linear...
BENIGNPAROXYSMALPOSITIONALVERTIGO,Episodic vertigo triggered by he...
HORIZONTALCANALBPPV,Geotropic / apogeotropic nystagm...
HEADTHRUSTTEST,Corrective saccade for periph. v...
PSEUDOBULBARAFFECT,Involuntary laughing / crying di...
BULBARPALSY,LMN weakness of cranial nerves I...
PSEUDOBULBARPALSY,UMN dysfunction of corticobulbar...
FRONTALRELEASESIGNS,Primitive reflexes re-emerging w...
CAPGRASSYNDROME,Delusion that a familiar person...
FREGOLISYNDROME,Delusion that different people a...
HEMISOMATOGNOSIA,Lack of awareness of one side of...
SOMATOPARAPHRENIA,Belief that a limb does not belo...
LARGEVESSELOCCLUSION,Proximal arterial blockage suita...
MEDIUMVESSELOCCLUSION,Branch occl. beyond M2/A2/P2 seg...
WAKEUPSTROKE,Symptoms discovered on awakening...
HEMORRHAGICTRANSFORMATION,Bleeding into an ischemic infarct
CERVICALARTERYDISSECTION,Intimal tear in carotid / verteb...
CAROTIDWEB,Shelf-like defect in ICA bulb pr...
VASOSPASM,Delayed arterial narrowing after...
DELAYEDCEREBRALISCHEMIA,New deficits / infarct after ane...
NIMODIPINE,Dihydropyridine used to prevent...
NICARDIPINE,IV calcium-channel blocker for a...
CLEVIDIPINE,Ultra-short-acting calcium-chann...
ICHSCORE,Grading system predicting mortal...
TICISCORE,Reperfusion grading after thromb...
MTICITWOB,Successful reperfusion grade in...
ABCOVERTWOMETHOD,Ellipsoid formula to estimate he...
ROPESCORE,Risk of Paradoxical Embolism sco...
ESUS,Embolic stroke of undetermined s...
PATENTFORAMENOVALE,Interatrial communication implic...
GASSERIANGANGLION,Trigeminal ganglion in Meckel cave
GENICULATEGANGLION,Facial nerve sensory ganglion in...
CILIARYGANGLION,Parasympathetic ganglion for pup...
OTICGANGLION,Parasympathetic ganglion to paro...
PTERYGOPALATINEGANGLION,Parasympathetic ganglion to lacr...
NUCLEUSAMBIGUUS,Motor nucleus for CN IX & X cont...
NUCLEUSSOLITARIUS,Visceral sensory nucleus for tas...
EDINGERWESTPHALNUCLEUS,Parasympathetic preganglionic nu...
DORSALMOTORNUCLEUSOFVAGUS,Parasympathetic output to thorac...
FACIALCOLLICULUS,Pons floor bump from CN VII fibe...
DERMATOMET2,Upper medial arm & axilla region
DERMATOMET3,Upper chest just below clavicles
DERMATOMET4,Nipple line dermatome
DERMATOMET5,Mid-chest territory
DERMATOMET6,Xiphoid level
DERMATOMET7,Below xiphoid across the trunk
DERMATOMET8,Upper abdomen region
DERMATOMET9,Mid-abdomen region
DERMATOMET10,Umbilicus dermatome
DERMATOMET11,Lower abdomen region
DERMATOMET12,Inguinal ligament region
MYOTOMES2,Knee flexion & plantarflexion co...
MYOTOMES3,External anal sphincter function
MYOTOMES4,Pelvic floor muscles & continence
MYOTOMES5,Perianal wink reflex contribution
KCNQ2ENCEPHALOPATHY,Neonatal epileptic enceph. due t...
SCN8AEPILEPTICENCEPHALOPATHY,Sodium channel-related developme...
KCNT1EPILEPSY,Epilepsy of infancy w/ migrating...
CACNA1AEPISODICATAXIA,Channelopathy causing EA2 & hemi...
PRRT2MUTATION,Paroxysmal kinesigenic dyskinesi...
ATP1A3,Alternating hemiplegia of childh...
SLC2A1DEFICIENCY,GLUT1 deficiency causing seizure...
AMAN,Acute motor axonal neurop. varia...
AMSAN,Acute motor-sensory axonal neuro...
POEMSSYNDROME,"Polyneuropathy w/ organomegaly,..."
CANOMAD,Chronic ataxic neurop. w/ ophtha...
HSAN,Hereditary sensory & autonomic n...
KENNEDYDISEASE,X-linked spinal & bulbar muscula...
APNEATEST,Assessment of brainstem function...
OCULOCEPHALICREFLEX,Doll's eyes test for brainstem i...
OCULOVESTIBULARREFLEX,Cold caloric testing for brainst...
COUGHREFLEX,Tracheal stimulation response ab...
CORNEALREFLEX,Blink response to corneal touch
MPTPTOXICITY,Causes parkinsonism via dopamine...
MANGANESETOXICITY,Parkinsonism w/ T1 hyperintensit...
NITROUSOXIDEMYELONEUROPATHY,Subacute combined degeneration m...
LEADNEUROPATHY,Motor-predominant neurop. w/ wri...
ARSENICNEUROPATHY,Painful sensorimotor axonopathy...
ORGANOPHOSPHATEPOISONING,"Cholinergic crisis w/ miosis, br..."
CARBONMONOXIDEPOISONING,Delayed neurologic sequelae w/ g...
TIMEDUPANDGO,Functional mobility test measuri...
BERGBALANCESCALE,14-item assessment of static & d...
CONSTRAINTINDUCEDTHERAPY,Use-dependent rehabilitation aft...
FESTINATINGGAIT,"Short, accelerating steps in Par..."
WIDEBASEDGAIT,Ataxic gait w/ increased base of...
STEPPAGEGAIT,High stepping due to foot drop
MAGNETICGAIT,Difficulty initiating steps in n...
HASHIMOTOENCEPHALOPATHY,Steroid-responsive enceph. assoc...
CLIPPERS,Pontine perivascular enhancement...
ACUTEHEMORRHAGICLEUKOENCEPHALITIS,Fulminant ADEM variant w/ rapid...
GFAPANTIBODY,Astrocytic filament antibody in...
BALINTSYNDROME,"Simultanagnosia, optic ataxia, &..."
SIMULTANAGNOSIA,Inability to perceive more than...
OPTICATAXIA,Misreaching for visual targets w...
OCULARAPRAXIA,Difficulty initiating purposeful...
LINEBISECTIONNEGLECT,Deviated midpoint marking on lin...
CANCELLATIONTASKNEGLECT,Omission of targets on one side...
PLEDS,Periodic lateralized epileptifor...
GPEDS,Generalized periodic epileptifor...
BURSTSUPPRESSION,Alternating high-voltage bursts...
TRIPHASICWAVES,EEG pattern seen in metabolic en...
PHOTOPAROXYSMALRESPONSE,Spike-wave discharges triggered...
3HZSPIKEANDWAVE,Classic absence seizure EEG pattern
HYPSARRHYTHMIA,Chaotic high-amplitude pattern i...
GAMMAKNIFE,Stereotactic radiosurgery device...
CYBERKNIFE,Robotic stereotactic radiotherap...
HEMICRANIECTOMY,Decompressive removal of skull f...
CRANIOPLASTY,Repair of skull defect after cra...
INFERIORCEREBELLARPEDUNCLE,Restiform body carrying afferent...
SUPERIORCOLLICULUS,Tectal structure mediating sacca...
INFERIORCOLLICULUS,Auditory midbrain relay nucleus
MEDIALLONGITUDINALFASCICULUS,Brainstem tract coordinating eye...
PRETECTALAREA,Midbrain region mediating pupill...
ANTERIORCOMMISSURE,Fiber tract connecting temporal...
POSTERIORCOMMISSURE,Fiber tract near pineal region l...
GABAARECEPTOR,Ligand-gated chloride channel ta...
GABABRECEPTOR,Metabotropic receptor targeted b...
NMDARECEPTOR,Glutamate receptor w/ voltage-de...
AMPARECEPTOR,Ionotropic glutamate receptor me...
NICOTINICACETYLCHOLINERECEPTOR,Ligand-gated ion channel at neur...
OPHTHALMICDIVISION,V1 branch of trigeminal nerve
MAXILLARYDIVISION,V2 branch of trigeminal nerve
MANDIBULARDIVISION,V3 branch of trigeminal nerve
CHORDATYMPANI,Branch of facial nerve carrying...
GREATERPETROSALNERVE,Facial nerve branch to pterygopa...
NERVUSINTERMEDIUS,Sensory/parasympathetic componen...
LEFTGAZEDEVIATION,Eyes deviated toward the left in...
LEFTNEGLECTONEXTINCTION,Failure to detect stimuli on the...
LEFTSENSORYLEVELATT10,Pinprick diminished below umbili...
RIGHTGAZEDEVIATION,Eyes deviated toward the right i...
RIGHTNEGLECTONEXTINCTION,Failure to detect stimuli on the...
RIGHTSENSORYLEVELATT10,Pinprick diminished below umbili...
A3SEGMENT,Pericallosal segment of ant. cer...
M3SEGMENT,Opercular branches of mid. cereb...
M4SEGMENT,Cortical branches of mid. cereb. a.
P3SEGMENT,Quadrigeminal segment of post. c...
P4SEGMENT,post. cereb. a. calcarine branches
FETALORIGINPCA,post. cereb. a. arises from inte...
LEFTTHALAMICSTROKE,Infarct predominantly affecting...
LEFTCAPSULARSTROKE,Infarct predominantly affecting...
LEFTPUTAMINALSTROKE,Infarct predominantly affecting...
LEFTCAUDATESTROKE,Infarct predominantly affecting...
LEFTPONTINESTROKE,Infarct predominantly affecting...
LEFTMEDULLARYSTROKE,Infarct predominantly affecting...
LEFTOCCIPITALSTROKE,Infarct predominantly affecting...
LEFTPARIETALSTROKE,Infarct predominantly affecting...
LEFTTEMPORALSTROKE,Infarct predominantly affecting...
LEFTFRONTALSTROKE,Infarct predominantly affecting...
LEFTCEREBELLARSTROKE,Infarct predominantly affecting...
RIGHTTHALAMICSTROKE,Infarct predominantly affecting...
RIGHTCAPSULARSTROKE,Infarct predominantly affecting...
RIGHTPUTAMINALSTROKE,Infarct predominantly affecting...
RIGHTCAUDATESTROKE,Infarct predominantly affecting...
RIGHTPONTINESTROKE,Infarct predominantly affecting...
RIGHTMEDULLARYSTROKE,Infarct predominantly affecting...
RIGHTOCCIPITALSTROKE,Infarct predominantly affecting...
RIGHTPARIETALSTROKE,Infarct predominantly affecting...
RIGHTTEMPORALSTROKE,Infarct predominantly affecting...
RIGHTFRONTALSTROKE,Infarct predominantly affecting...
RIGHTCEREBELLARSTROKE,Infarct predominantly affecting...
DAWSONFINGERS,Ovoid periventricular lesions pe...
UFIBERSPARING,Subcortical myelin preservation...
BLACKHOLESINMS,T1 hypointense chronic lesions i...
OPENRINGSIGN,Incomplete ring enhancement sugg...
LEFTFRONTALLOBEINFARCT,Ischemic injury in the frontal l...
LEFTPARIETALLOBEINFARCT,Ischemic injury in the parietal...
LEFTTEMPORALLOBEINFARCT,Ischemic injury in the temporal...
LEFTOCCIPITALLOBEINFARCT,Ischemic injury in the occipital...
LEFTINSULARLOBEINFARCT,Ischemic injury in the insular l...
LEFTMCABRANCHOCCLUSION,Branch vessel blockage in the MC...
LEFTACABRANCHOCCLUSION,Branch vessel blockage in the AC...
LEFTPCABRANCHOCCLUSION,Branch vessel blockage in the PC...
RIGHTFRONTALLOBEINFARCT,Ischemic injury in the frontal l...
RIGHTPARIETALLOBEINFARCT,Ischemic injury in the parietal...
RIGHTTEMPORALLOBEINFARCT,Ischemic injury in the temporal...
RIGHTOCCIPITALLOBEINFARCT,Ischemic injury in the occipital...
RIGHTINSULARLOBEINFARCT,Ischemic injury in the insular l...
RIGHTMCABRANCHOCCLUSION,Branch vessel blockage in the MC...
RIGHTACABRANCHOCCLUSION,Branch vessel blockage in the AC...
RIGHTPCABRANCHOCCLUSION,Branch vessel blockage in the PC...
SENSORYLEVELATC2,Pinprick reduced below dermatoma...
SENSORYLEVELATC3,Pinprick reduced below dermatoma...
SENSORYLEVELATC4,Pinprick reduced below dermatoma...
SENSORYLEVELATL1,Pinprick reduced below dermatoma...
HIGHVOLUMETAPTEST,Large-volume lumbar puncture ass...
CSFFLOWVOIDSIGN,Sagittal T2 flow signal in aqued...
CALLOSALANGLE,Smaller angle on coronal MRI sup...
WERNICKETRIAD,"Confusion, ataxia, ophthalmopleg..."
HYPERAMMONEMIA,Elevated ammonia causing enceph.
UREMICENCEPHALOPATHY,Cognitive & neuromuscular dysfun...
HYPOGLYCEMICSEIZURES,Convulsions precipitated by low...
LEFTFINGERTONOSE,Dysmetria on finger-to-nose test...
LEFTHEELTOSHIN,Ataxia on ipsilateral heel-to-sh...
LEFTRAPIDALTERNATINGMOVEMENTS,Impaired diadochokinesia on fast...
LEFTDYSDIADOCHOKINESIA,Impaired rapid alternating movem...
RIGHTFINGERTONOSE,Dysmetria on finger-to-nose test...
RIGHTHEELTOSHIN,Ataxia on ipsilateral heel-to-sh...
RIGHTRAPIDALTERNATINGMOVEMENTS,Impaired diadochokinesia on fast...
RIGHTDYSDIADOCHOKINESIA,Impaired rapid alternating movem...
LEFTTEMPORALPOLEINFARCT,ischemia involving the temporal...
LEFTINSULAINFARCT,ischemia involving the insula on...
LEFTANGULARGYRUSINFARCT,ischemia involving the angular g...
LEFTPARACENTRALLOBULEINFARCT,ischemia involving the paracentr...
LEFTPRECUNEUSINFARCT,ischemia involving the precuneus...
LEFTFUSIFORMGYRUSINFARCT,ischemia involving the fusiform...
LEFTLINGUALGYRUSINFARCT,ischemia involving the lingual g...
LEFTPCOMANEURYSM,Aneurysm at the PCom on the left...
LEFTACOMANEURYSM,Aneurysm at the ACom on the left...
LEFTMCABIFURCATIONANEURYSM,Aneurysm at the MCA on the left...
RIGHTTEMPORALPOLEINFARCT,ischemia involving the temporal...
RIGHTINSULAINFARCT,ischemia involving the insula on...
RIGHTANGULARGYRUSINFARCT,ischemia involving the angular g...
RIGHTPARACENTRALLOBULEINFARCT,ischemia involving the paracentr...
RIGHTPRECUNEUSINFARCT,ischemia involving the precuneus...
RIGHTFUSIFORMGYRUSINFARCT,ischemia involving the fusiform...
RIGHTLINGUALGYRUSINFARCT,ischemia involving the lingual g...
RIGHTPCOMANEURYSM,Aneurysm at the PCom on the righ...
RIGHTACOMANEURYSM,Aneurysm at the ACom on the righ...
RIGHTMCABIFURCATIONANEURYSM,Aneurysm at the MCA on the right...
CAVERNOUSSINUSTHROMBOSIS,Septic thrombosis causing ophtha...
CEREBRALVENOUSSINUSTHROMBOSIS,Headache w/ papilledema from dur...
DURALARTERIOVENOUSFISTULA,Abnormal shunt causing pulsatile...
CAROTIDCAVERNOUSFISTULA,"Traumatic shunt w/ red eye, brui..."
PITUITARYAPOPLEXY,Acute bleed/infarct of pituitary...
TEMPORALARTERITIS,Giant cell arteritis causing hea...
PSEUDOTUMORCEREBRI,Old name for idiopathic intracra...
SPONTANEOUSINTRACRANIALHYPOTENSION,Orthostatic headache from CSF leak
EPIDURALBLOODPATCH,Treatment for CSF leak-related o...
ORTHOSTATICHEADACHE,"Headache worse upright, relieved..."
RAMSAYHUNTSYNDROME,Herpes zoster oticus w/ facial p...
VESTIBULARMIGRAINE,Recurrent vertigo episodes assoc...
PERSISTENTPOSTURALPERCEPTUALDIZZINESS,Chronic subjective dizziness wor...
MALDEDEBARQUEMENT,Persistent rocking sensation aft...
OSCILLOPSIA,Illusion of visual world bouncin...
PERIODICALTERNATINGNYSTAGMUS,Horizontal nystagmus reversing d...
OCULOGYRICCRISIS,Upward tonic eye deviation from...
BLEPHAROSPASM,Involuntary eyelid closure dystonia
MEIGESYNDROME,Cranial dystonia w/ blepharospas...
LARYNGEALDYSTONIA,Task-specific dysphonia from foc...
CERVICALDYSTONIA,Torticollis from involuntary nec...
WRITERSCRAMP,Task-specific hand dystonia duri...
TASKSPECIFICDYSTONIA,Abnormal muscle activation limit...
FUNCTIONALNEUROLOGICALDISORDER,Positive-sign based diagnosis of...
HOOVERSIGN,Inconsistent hip extension effor...
RADIALTUNNELSYNDROME,Pain & weakness from post. inter...
ANTERIORINTEROSSEOUSNEUROPATHY,Weak pinch w/ intact sensation;...
POSTERIORINTEROSSEOUSNEUROPATHY,Finger & wrist extension weaknes...
PRONATORTERESSYNDROME,Median nerve entrapment in proxi...
ERBPALSY,Upper trunk brachial plexus pals...
KLUMPKEPALSY,Lower trunk plexus injury w/ han...
ADIETONICPUPIL,Dilated pupil w/ poor light resp...
ARGYLLROBERTSONPUPIL,Small pupils that accommodate bu...
MARCUSGUNNPUPIL,Relative afferent pupillary defe...
LIGHTNEARDISSOCIATION,Better constriction to near than...
MUSKANTIBODY,Muscle-specific kinase antibody...
LRP4ANTIBODY,Low-density lipoprotein receptor...
THYMOMA,ant. mediastinal tumor associate...
SINGLEFIBERJITTER,Increased variability on EMG in...
REDUCEDRECRUITMENT,"EMG pattern w/ fewer, larger mot..."
SMALLFIBERSKINBIOPSY,Intraepidermal nerve fiber densi...
NERVEULTRASOUND,High-resolution img for entrapme...
TILTTABLETEST,Autonomic evaluation provoking o...
VALSALVAMANEUVER,Autonomic testing component asse...
LEIGHSYNDROME,Subacute necrotizing encephalomy...
ALPERSSYNDROME,POLG-related epileptic enceph. w...
ADRENOMYELONEUROPATHY,Adult-onset X-linked adrenoleuko...
KRABBEDISEASE,Galactocerebrosidase deficiency...
METACHROMATICLEUKODYSTROPHY,Arylsulfatase A deficiency causi...
ALEXANDERDISEASE,GFAP mutation leukodystrophy w/...
CANAVANDISEASE,Aspartoacylase deficiency w/ spo...
PELIZAEUSMERZBACHER,PLP1-related hypomyelinating leu...
VANISHINGWHITEMATTERDISEASE,eIF2B-related childhood ataxia &...
RETTSYNDROME,MECP2-related neurodevelopmental...
ANGELMANSYNDROME,"UBE3A disorder w/ ataxia, seizur..."
NIEMANNPICKTYPEC,Cholesterol trafficking disorder...
TAYSACHSDISEASE,Hexosaminidase A deficiency w/ c...
SUBACUTECOMBINEDDEGENERATION,B12 deficiency causing dorsal co...
CORTICOBASALDEGENERATION,Asymmetric parkinsonism w/ aprax...
PARKINSONISMHYPERPYREXIA,Life-threatening akinesia & hype...
NEUROLEPTICMALIGNANTSYNDROME,"Rigidity, hyperthermia, & autono..."
SEROTONINSYNDROME,"Hyperreflexia, clonus, & agitati..."
DYSTONICSTORM,Severe generalized dystonia w/ a...
SUPERREFRACTORYSTATUSEPILEPTICUS,Seizures persist beyond 24 hours...
NORSE,New-onset refractory status epil...
FIRES,Febrile infection-related epilep...
ACUTEFLACCIDMYELITIS,Poliomyelitis-like illness w/ an...
IGG4PACHYMENINGITIS,Hypertrophic dura from IgG4-rela...
CSFLEAK,Spinal / cranial breach causing...
KAYSERFLEISCHERRING,Corneal copper deposition in Wil...
POSTERIORCOMMUNICATINGARTERY,Connecting vessel between ICA & PCA
ANTERIORCOMMUNICATINGARTERY,Vessel connecting the two ACAs
SUPERIORSAGITTALSINUS,Major dural venous sinus along t...
TRANSVERSESINUS,Paired dural venous sinus draini...
SIGMOIDSINUS,Dural venous sinus continuing to...
CAVERNOUSSINUS,Venous plexus around sella w/ cr...
CAROTIDSIPHON,Curved intracranial segment of i...
DEEPCEREBRALVENOUSSYSTEM,"Internal cereb. veins, v. of Gal..."
VEINOFGALENMALFORMATION,High-flow neonatal AV shunt caus...
PITUITARYMACROADENOMA,Large sellar tumor compressing o...
OPTICCHIASMCOMPRESSION,Bitemporal field loss from sella...
CEREBELLARTONSILLARECTOPIA,Inferior displacement of tonsils...
MIDLINESHIFT,Displacement of septum pellucidu...
DIFFUSEAXONALINJURY,Traumatic shearing injury w/ mic...
RANCHOLOSAMIGOSSCALE,Ten-level cognitive scale for TB...
POSTTRAUMATICAMNESIA,Interval of memory loss after he...
ANTERIORINTEROSSEOUSSYNDROME,Pure motor median branch palsy w...
CARPALCOMPRESSIONTEST,Manual pressure over carpal tunn...
GUYONCANALSYNDROME,Ulnar nerve compression at wrist...
CUBITALTUNNELSYNDROME,Ulnar entrapment at the elbow
RADIALHEADSUBLUXATION,Nursemaid elbow affecting annula...
NECKTONGUESYNDROME,Transient C2 neuralgia w/ tongue...
BRACHIORADIALISREFLEX,C6-mediated forearm reflex at ra...
PATELLARREFLEX,L3-L4 mediated knee jerk
ACHILLESREFLEX,S1-S2 mediated ankle jerk
JAWWOBBLETREMOR,Essential tremor manifestation o...
CEREBELLARREBOUND,Failure to check movement after...
ASTASIA,Inability to maintain upright po...
ABASIA,Inability to walk despite preser...
THALAMICPAINSYNDROME,Central post-stroke pain after t...
ALIENHANDSYNDROME,Complex involuntary movements w/...
CENTRALCORDHYPEREXTENSION,Disproportionate arm weakness af...
BROWNOUTAMAUROSIS,Transient monocular vision loss...
AMAUROSISFUGAX,Transient monocular blindness us...
ANTERIORISCHEMICOPTICNEUROPATHY,Pale swollen disc w/ sudden visi...
PAPILLITIS,Optic neuritis w/ disc swelling
CENTRALRETINALARTERYOCCLUSION,Painless monocular vision loss w...
CENTRALRETINALVEINOCCLUSION,Painless vision loss w/ 'blood &...
MYERSONSIGN,Persistent glabellar tap blink i...
HINTSPLUS,HINTS exam w/ new hearing loss t...
DUKECRITERIAENDOCARDITIS,Neurologic embolic strokes part...
HEIMANNBIELSCHOWSKYPHENOMENON,Head tilt in superior oblique pa...
SKULLBASEOSTEOMYELITIS,Malignant otitis externa causing...
LENNOXGASTAUTDROPATTACKS,Atonic seizures causing sudden f...
JUVENILEABSENCEEPILEPSY,Adolescent onset absence w/ gene...
PHOTOSENSITIVEEPILEPSY,Seizures triggered by flashing l...
STARTLEEPILEPSY,Reflex seizures precipitated by...
MUSICOGENICEPILEPSY,Reflex seizures triggered by spe...
REFLEXSYNCOPE,Vasovagal faint w/ prodrome & ra...
ORTHOSTATICSYNCOPE,Loss of consciousness from stand...
CAROTIDSINUSHYPERSENSITIVITY,Syncope triggered by neck pressu...
POSTURALORTHOSTATICTACHYCARDIA,Excessive heart rate rise on sta...
NEUROCARDIOGENICSYNCOPE,Common faint due to autonomic re...
PARANEOPLASTICCEREBELLARDEGENERATION,Subacute ataxia due to antibodie...
OPSOCLONUSMYOCLONUSATAXIA,Paraneoplastic / post-infectious...
EPISODICATAXIA,Brief spells of ataxia often due...
HEMIPLEGICMIGRAINE,Migraine w/ transient unilateral...
SPORADICHEMIPLEGICMIGRAINE,Hemiplegic migraine w/o known fa...
FAMILIALHEMIPLEGICMIGRAINE,CACNA1A-linked migraine w/ motor...
CEREBELLARCOGNITIVEAFFECTIVE,"synd. w/ executive, visuospatial..."
ALIENLIMBPHENOMENON,Loss of sense of ownership causi...
LEFTPICAANEURYSM,Saccular dilation of the PICA on...
LEFTPICATHROMBOSIS,Occlusive clot in the PICA on th...
LEFTPICADISSECTION,Intimal tear of the PICA on the...
LEFTAICAANEURYSM,Saccular dilation of the AICA on...
LEFTAICATHROMBOSIS,Occlusive clot in the AICA on th...
